name,country,city,businessType
UNIVERSIDAD DE COSTA RICA,Costa Rica,SAN PEDRO DE MONTES DE OCA SAN JOSE,Higher or Secondary Education Establishments
INSTITUTO CENTROAMERICANO DE ADMINISTRACION DE EMPRESAS,Costa Rica,ALAJUELA,Higher or Secondary Education Establishments
MUSEO NACIONAL DE COSTA RICA,Costa Rica,SAN JOSE,Public bodies (excluding Research Organisations and Secondary or Higher Education Establishments)
FACULTAD LATINOAMERICANA DE CIENCIAS SOCIALES,Costa Rica,CURRIDABAT,Higher or Secondary Education Establishments
FUNDACION CENTRO DE ALTA TECNOLOGIA,Costa Rica,SAN JOSE,Research Organisations
UNIVERSIDAD NACIONAL,Costa Rica,HEREDIA,Higher or Secondary Education Establishments
CENTRO AGRONOMICO TROPICAL DE INVESTIGACION Y ENSENANZA CATIE,Costa Rica,TURRIALBA,Higher or Secondary Education Establishments
ESCUELA DE AGRICULTURA DE LA REGION TROPICAL HUMEDA,Costa Rica,SAN JOSE,Other
FUNDACION AMOR ESPERANZA Y VIDA,Costa Rica,HEREDIA,Other
Ministerio de Ciencia y Tecnologia de Costa Rica,Costa Rica,SAN JOSE,Public bodies (excluding Research Organisations and Secondary or Higher Education Establishments)
UNION NACIONAL DE GOBIERNOS LOCALES,Costa Rica,SAN JOSE,Public bodies (excluding Research Organisations and Secondary or Higher Education Establishments)
ASOCIACION DE DESARROLLO INTEGRAL DE SALITRILLOS DE CONCEPCION DE LA UNION,Costa Rica,CARTAGO,Other
ESCUELA AUTONOMA DE CIENCIAS MEDICAS DE CENTRO AMERICA,Costa Rica,SAN JOSE,Higher or Secondary Education Establishments
CENTRO AGRONOMICO TROPICAL DE INVESTIGACION Y ENSENANZA,Costa Rica,TURRIALBA,Unknown
Instituto Interamericano de Cooperación para la Agricultura,Costa Rica,San José,Unknown
Universidad de Costa Rica,Costa Rica,San José - Costa Rica,Unknown
Centro Agronómico Tropical de Investigación y Enseñanza,Costa Rica,Turrialba,Unknown
Universidad de Costa Rica,Costa Rica,San José,Unknown
Universidad Nacional Costa Rica,Costa Rica,"San Isidro de General, Brunca",Unknown
Universidad Nacional Costa Rica,Costa Rica,Heredia,Unknown
FUNDACION DE LA UNIVERSIDAD DE COSTA RICA PARA LA INVESTIGACION,Costa Rica,SAN PEDRO,Unknown
Fundacion para el Desarollo Urbano,Costa Rica,San José,Unknown
Centro de Derecho Ambiental y de los Recursos Naturales,Costa Rica,San José,Unknown
Corporacion Bananera Nacional,Costa Rica,Guapiles,Unknown
Universitad Nacional,Costa Rica,heredia,Unknown
UNIVERSIDAD DE COSTA RICA,Costa Rica,SAN PEDRO,Unknown
INSTITUTO COSTARRICENSE DE INVESTIGACION Y ENSENANZA EN NUTRICION Y SALUD,Costa Rica,TRES RIOS,Unknown
UNIVERSIDAD NACIONAL COSTA RICA,Costa Rica,HEREDIA,Unknown
FUNDACION PRO CIENCIA ARTE Y CULTURA DE LA UNIVERSIDAD NACIONAL,Costa Rica,HEREDIA,Unknown
CORPORACION BANANERA NACIONAL,Costa Rica,GUAPILES,Unknown
UNIVERSIDAD DE COSTA RICA,Costa Rica,,Unknown
ASOCIACIÓN INSTITUTO NACIONAL DE BIODIVERSIDAD,Costa Rica,HEREDIA,Unknown
ASOCIACIÓN COORDINADORA INDÍGENA Y CAMPESINA DE AGROFORESTERÍA COMUNITARIA,Costa Rica,SAN JOSÉ,Unknown
ASOCIACION CAMARA DE TECNOLOGIAS DE INFORMACION Y COMUNICACION,Costa Rica,"SAN PEDRO DE MONTES DE OCA, SAN JOSE",Unknown
FUNDACION UNIVERSIDAD NACIONAL DE COSTA RICA,Costa Rica,HEREDIA,Unknown
UNIVERSIDAD DE COSTA RICA,Costa Rica,SAN PEDRO DE MONTES DE OCA SAN JOSE,Unknown
INSTITUTO TECNOLOGICO DE COSTA RICA,Costa Rica,CARTAGO,Unknown
CENTRO AGRONÓMICO TROPICAL DE INVESTIGACIÓN Y ENSEÑANZA,Costa Rica,"TURRIALBA, CARTAGO",Unknown
CENTRO NACIONAL DE CIENCIA TECNOLOGIA DE ALIMENTOS/UNIVERSIDAD DE COSTA RICA,Costa Rica,SAN PEDRO DE MONTES DE OCA,Unknown
"OBSERVATORIO VULCANOLOGICO Y SISMOLOGICO DE COSTA RICA, UNIVERSIDAD NACIONAL",Costa Rica,HEREDIA,Unknown
Ministerio de Salud de la Republica de Costa Rica,Costa Rica,San Jose,Public bodies (excluding Research Organisations and Secondary or Higher Education Establishments)
INSTITUTO TECNOLOGICO DE COSTA RICA,Costa Rica,CARTAGO,Higher or Secondary Education Establishments
INSTITUTO INTERAMERICANO DE COOPERACION INTERNACIONAL PARA LA AGRICULTURA IICA,Costa Rica,SAN JOSE,Research Organisations
FUNDACION NEOTROPICA,Costa Rica,SAN JOSE,Research Organisations
FEDERACION DE ASOCIACIONES DE LATINOAMERICA EL CARIBE Y ESPANA DE ENTIDADES DE TECNOLOGIAS DE LA INFORMACION,Costa Rica,SAN PEDRO DE MONTES DE OCA,Private for-profit entities (excluding Higher or Secondary Education Establishments)
FUNDACION INSTITUTO CENTRO AMERICANO DE SALUD INTERNATIONAL,Costa Rica,SAN JOSE,Research Organisations
ASOCIACION DE REGULADORES REGULATEL AD,Costa Rica,SAN JOSE,Private for-profit entities (excluding Higher or Secondary Education Establishments)
ASOCIACION CAMARA DE TECNOLOGIAS DE INFORMACION Y COMUNICACION,Costa Rica,SAN JOSE,Other
FUNDACION PARA EL DESARROLLO ACADEMICO DE LA UNIVERSIDAD NACIONAL,Costa Rica,HEREDIA,Research Organisations
ASOCIACION INSTITUTO NACIONAL DE BIODIVERSIDAD,Costa Rica,SANTO DOMINGO DE HEREDIA,Research Organisations
Earth Charter Initiative,Costa Rica,San Jose,Research Organisations
