name,country,city,businessType
SYNCHROTRON-LIGHT FOR EXPERIMENTAL SCIENCE AND APPLICATIONS IN THE MIDDLE EAST,Jordan,ALLAN,Public bodies (excluding Research Organisations and Secondary or Higher Education Establishments)
THE HIGHER COUNCIL FOR SCIENCE AND TECHNOLOGY HCST,Jordan,AMMAN,Public bodies (excluding Research Organisations and Secondary or Higher Education Establishments)
UNIVERSITY OF JORDAN,Jordan,Amman,Higher or Secondary Education Establishments
JORDAN UNIVERSITY OF SCIENCE AND TECHNOLOGY,Jordan,IRBID,Higher or Secondary Education Establishments
GREATER AMMAN MUNICIPALITY,Jordan,AMMAN,Public bodies (excluding Research Organisations and Secondary or Higher Education Establishments)
YARMOUK UNIVERSITY,Jordan,IRBID,Higher or Secondary Education Establishments
ROYAL SCIENTIFIC SOCIETY,Jordan,AL-JUBAIHA/AMMAN,Research Organisations
GENERATIONS FOR PEACE,Jordan,AMMAN,Research Organisations
"NATIONAL AGRICULTURAL RESEARCH CENTER, MINISTRY OF AGRICULTURE",Jordan,AMMAN,Research Organisations
RAED SALEM AND PARTNER CO,Jordan,AMMAN,Private for-profit entities (excluding Higher or Secondary Education Establishments)
National Electric Power Company,Jordan,Amman,Unknown
Al Al-Bayt Univeristy,Jordan,Jubyha,Unknown
Yarmouk University,Jordan,Irbid,Unknown
The Royal Scientific Society,Jordan,Amman,Unknown
ENVIROCONSULT OFFICE,Jordan,AMMAN,Unknown
UNIVERSITY OF JORDAN,Jordan,AMMAN,Unknown
University of Jordan,Jordan,Amman,Unknown
Water Authority of Jordan,Jordan,Amman,Unknown
The Royal Scientific Society // Al Jameiyah Al Ilmiya Al Malakiya,Jordan,Amman,Unknown
Amman University,Jordan,Amman,Unknown
Arab Turnkey Systems Ltd // As-Sharika Al Arabia Li Nodhom Al Hasub Al Mutakamila,Jordan,Amman,Unknown
Jordan University of Science and Technology,Jordan,Irbid,Unknown
UNIVERSITY OF JORDAN,Jordan,AMMAN / AL-JUBAIHA,Unknown
JORDAN UNIVERSITY OF SCIENCE AND TECHNOLOGY,Jordan,IRBID,Unknown
Mdg -Management & Development Group,Jordan,Ammam,Unknown
ROYAL SCIENTIFIC SOCIETY,Jordan,AL-JUBAIHA/AMMAN,Unknown
THE HIGHER COUNCIL FOR SCIENCE AND TECHNOLOGY,Jordan,AMMAN / AL-JUBAIHA,Unknown
THE HASHEMITE UNIVERSITY,Jordan,ZERKA,Unknown
AMMAN UNIVERSITY,Jordan,AMMAN,Unknown
CONSOLIDATED CONSULTANTS - ENGINEERING AND ENVIRONMENT,Jordan,AMMAN,Unknown
THE ROYAL SCIENTIFIC SOCIETY,Jordan,AMMAN / AL-JUBAIHA,Unknown
DAR AL-OMRAN,Jordan,AMMAN,Unknown
NATIONAL CENTER FOR AGRICULTURAL RESEARCH AND TECHNOLOGY TRANSFER,Jordan,BAQA-AMMAN,Unknown
MINISTRY OF WATER AND IRRIGATION,Jordan,AMMAN,Unknown
MANAGEMENT AND DEVELOPMENT GROUP,Jordan,AMMAN,Unknown
THE ROYAL JORDANIAN GEOGRAPHIC CENTRE,Jordan,AMMAN / AL-JUBAIHA,Unknown
NATIONAL ENERGY RESEARCH CENTRE,Jordan,AMMAN / AL-JUBAIHA,Unknown
TIBAH CONSULTANTS SA,Jordan,AMMAN,Unknown
JORDAN UNIVERSITY OF SCIENCE AND TECHNOLOGY,Jordan,IRBED,Unknown
MINISTRY OF HEALTH OF JORDAN,Jordan,AMMAN,Unknown
YARMOUK UNIVERSITY,Jordan,IRBED,Unknown
MINISTRY OF TOURISM AND ANTIQUITIES,Jordan,AMMAN,Unknown
NATURAL RESOURCES AUTHORITY,Jordan,AMMAN,Unknown
THE JORDANIAN SOCIETY FOR DESERTIFICATION CONTROL AND BADIA DEVELOPMENT,Jordan,AMMAN,Unknown
ARABIC TEXTWARE LTD,Jordan,AMMAN,Unknown
MINISTRY OF AGRICULTURE,Jordan,AMMAN,Unknown
JORDAN VALLEY FARMERS ASSOCIATION,Jordan,DEIR ALA,Unknown
NATIONAL ENERGY RESEARCH CENTRE,Jordan,AMMAN,Unknown
YARMOUK UNIVERSITY,Jordan,IRBID,Unknown
THE HIGHER COUNCIL FOR SCIENCE AND TECHNOLOGY,Jordan,AMMAN,Unknown
UNIVERSITY OF JORDAN,Jordan,AMMAN/ AL-JUBAIHA,Unknown
"FACULTY OF AGRICULTURE, UNIVERSITY OF JORDAN",Jordan,AMMAN,Unknown
NATIONAL CENTER FOR AGRICULTURAL RESEARCH AND TECHNOLOGY TRANSFER,Jordan,AMMAN,Unknown
NATIONAL ENERGY RESEARCH CENTRE JORDAN,Jordan,ALJBEIHA AMMAN,Unknown
NATIONAL ENERGY RESEARCH CENTER,Jordan,AMMAN,Unknown
HIGHER COUNCIL FOR SCIENCE AND TECHNOLOGY,Jordan,AMMAN,Unknown
ROYAL SCIENTIFIC SOCIETY,Jordan,AMMAN,Unknown
NATIONAL ENERGY RESEARCH CENTER,Jordan,"AL-JUBIHA, AMMAN",Unknown
"NATIONAL CENTER FOR DIABETES, ENDOCRINE AND GENETIC DISEASES",Jordan,AMMAN,Unknown
MINISTRY OF TOURISM AND ANTIQUITIES/DEPARTMENT OF ANTIQUITIES,Jordan,AMMAN,Unknown
"BUILDING RESEARCH CENTER (BRC), ROYAL SCIENTIFIC SOCIETY (RSS)",Jordan,AMMAN,Unknown
PHILADELPHIA UNIVERSITY,Jordan,AMMAN,Unknown
"UNIVERSITY OF JORDAN, FACULTY OF AGRICULTURE",Jordan,AMMAN,Unknown
PETRA NATIONAL TRUST,Jordan,AMMAN,Unknown
NATIONAL CENTRE FOR AGRICULTURAL RESEARCH AND TECHNOLOGY TRANSFER,Jordan,AMMAN,Unknown
GREEK ORTHODOX METROPOLIA,Jordan,AMMAN,Unknown
INTER-ISLAMIC NETWORK ON WATER RESOURCES DEVELOPMENT AND MANAGEMENT,Jordan,JUBEIHA - AMMAN,Unknown
AL-BALQA APPLIED UNIVERSITY,Jordan,SALT,Unknown
ROYAL SCIENTIFIC SOCIETY,Jordan,ALJUBIAHA,Unknown
FACULTY OF ARCHAEOLOGY AND ANTHROPOLOGY-YARMOUK UNIVERSITY,Jordan,IRBID,Unknown
ROYAL SCIENTIFIC SOCIETY.,Jordan,AL-JUBIEHA/AMMAN,Unknown
NATIONAL ENERGY RESEARCH CENTER,Jordan,AL-JUBIHA - AMMAN,Unknown
"YARMOUK UNIVERSITY, FACULTY OF ARCHAEOLOGY AND ANTHROPOLOGY",Jordan,IRBID,Unknown
ROYAL SCIENTIFIC SOCIETY - MECHANICAL DESIGN AND TECHNOLOGY CENTER,Jordan,AMMAN,Unknown
"DEPT. BIOLOGICAL SCIENCES, YARMOUK UNIVERSITY",Jordan,IRBID,Unknown
BUSINESS PARK FOR PROJECT DEVELOPMENT,Jordan,AMMAN,Private for-profit entities (excluding Higher or Secondary Education Establishments)
AL-AHLYYA AMMAN UNIVERSITY,Jordan,AMMAN,Higher or Secondary Education Establishments
Princess Sumaya University for Technology,Jordan,Amman,Higher or Secondary Education Establishments
KAWAR ENERGY LTD CO LLC,Jordan,Amman,Private for-profit entities (excluding Higher or Secondary Education Establishments)
Department of Antiquities,Jordan,AMMAN,Public bodies (excluding Research Organisations and Secondary or Higher Education Establishments)
MINISTRY OF TRANSPORT,Jordan,AMMAN,Public bodies (excluding Research Organisations and Secondary or Higher Education Establishments)
HASHEMITE UNIVERSITY,Jordan,ZARQA,Research Organisations
MUTAH UNIVERSITY LTD,Jordan,KARAK,Higher or Secondary Education Establishments
NATIONAL CENTER FOR RESEARCH AND DEVELOPMENT,Jordan,AMMAN,Research Organisations
YACOUB SAKKAB AND PARTNERS CO GENERAL PARTNERSHIP,Jordan,AMMAN,Private for-profit entities (excluding Higher or Secondary Education Establishments)
ROYAL BOTANIC GARDEN CO LLC,Jordan,AMMAN,Other
JORDAN SOCIETY FOR SCIENTIFIC RESEARCH,Jordan,AMMAN,Research Organisations
NATIONAL ENERGY RESEARCH CENTRE,Jordan,AMMAN / AL-JUBAIHA,Research Organisations
Regional Centre on Conflict Prevention,Jordan,Amman,Research Organisations
INDEPENDENT INSTITUTE FOR ADMINISTRATION AND CIVIL SOCIETY STUDY,Jordan,AMMAN,Private for-profit entities (excluding Higher or Secondary Education Establishments)
JORDANIAN UNIVERSITIES NETWORK,Jordan,Amman,Other
KING HUSSEIN CANCER FOUNDATION,Jordan,Amman,Research Organisations
SMALL AND MEDIUM ENTERPRISES ASSOCIATION,Jordan,AMMAN,Private for-profit entities (excluding Higher or Secondary Education Establishments)
INTERNATIONAL ENERGY TECHNOLOGY INDUSTRIES LLC,Jordan,AMMAN,Private for-profit entities (excluding Higher or Secondary Education Establishments)
Jordan Enterprise Development Corporation,Jordan,Amman,Public bodies (excluding Research Organisations and Secondary or Higher Education Establishments)
