name,country,city,businessType
TRUONG DAI HOC LUAT TP.HCM,Vietnam,HO CHI MINH CITY,Higher or Secondary Education Establishments
TRUONG DAI HOC NHA TRANG,Vietnam,NHA TRANG KHANH HOA,Higher or Secondary Education Establishments
UNIVERSITY OF TRANSPORT TECHNOLOGY,Vietnam,HANOI,Higher or Secondary Education Establishments
HANOI DEPARTMENT OF TRANSPORT,Vietnam,HA DONG,Public bodies (excluding Research Organisations and Secondary or Higher Education Establishments)
THAI NGUYEN UNIVERSITY OF MEDICINE AND PHARMACY,Vietnam,THAI NGUYEN,Higher or Secondary Education Establishments
INSTITUTE OF HEALTH STRATEGY AND POLICY,Vietnam,HANOI,Other
UNIVERSITY OF ENGINEERING AND TECHNOLOGY - VIETNAM NATIONAL UNIVERSITY - HA NOI,Vietnam,HANOI,Higher or Secondary Education Establishments
CAN THO UNIVERSITY,Vietnam,Can Tho City,Higher or Secondary Education Establishments
TRUONG DAI HOC Y DUOC TP.HCM,Vietnam,HO CHI MINH CITY,Higher or Secondary Education Establishments
TRUONG DAI HOC CONG NGHE TP HCM,Vietnam,HO CHI MINH,Higher or Secondary Education Establishments
VIETNAM ACADEMY OF AGRICULTURAL SCIENCES,Vietnam,HANOI,Public bodies (excluding Research Organisations and Secondary or Higher Education Establishments)
TRUONG DAI HOC BACH KHOA HANOI - HANOI UNIVERSITY OF SCIENCE AND TECHNOLOGY HUST,Vietnam,HANOI,Higher or Secondary Education Establishments
BIN DINH PEOPLE'S COMMITTEE,Vietnam,QUY NHON,Public bodies (excluding Research Organisations and Secondary or Higher Education Establishments)
CONG TY TNHH DAI HOC RMIT VIET NAM,Vietnam,HO CHI MINH CITY,Higher or Secondary Education Establishments
TRUONG DAI HOC KINH TE THUOC DAI HOC QUOC GIA HANOI,Vietnam,HANOI,Higher or Secondary Education Establishments
CONG TY TNHH LUONG THUC TAN VUONG,Vietnam,AN GIANG,Private for-profit entities (excluding Higher or Secondary Education Establishments)
CONGTY TNHH HOA LAM,Vietnam,PHU YEN,Private for-profit entities (excluding Higher or Secondary Education Establishments)
TRUONG DAI HOC NONG LAM - THANH PHO HO CHI MINH,Vietnam,HO CHI MINH CITY,Higher or Secondary Education Establishments
NATIONAL INSTITUTE OF ANIMAL SCIENCE,Vietnam,HANOI,Public bodies (excluding Research Organisations and Secondary or Higher Education Establishments)
TRUONG DAI HOC QUOC TE,Vietnam,HO CHI MINH,Higher or Secondary Education Establishments
TRUONG DAI HOC KINH TE THANH PHO HO CHI MINH,Vietnam,HO CHI MINH,Higher or Secondary Education Establishments
DAI HOC Y KHOA PHAM NGOC THACH (PHAM NGOC THACH UNIVERSITY OF MEDICINE),Vietnam,HO CHI MINH CITY,Higher or Secondary Education Establishments
CONG TY TNHH DIGITAL IDENTITY,Vietnam,HO CHI MINH,Private for-profit entities (excluding Higher or Secondary Education Establishments)
VIEN KHOA HOC CONG NGHE VINASA,Vietnam,HANOI,Other
TRUONG DAI HOC TON DUC THANG,Vietnam,HO CHI MINH,Higher or Secondary Education Establishments
VIEN KHOA HOC XA HOI VIET NAM,Vietnam,HANOI,Research Organisations
TRUONG DAI HOC SAI GON,Vietnam,HO CHI MINH,Higher or Secondary Education Establishments
National Centre for Human Resources for Health,Vietnam,Hanoi,Unknown
University of Can Tho,Vietnam,"Can Tho, Province Hau Giang",Unknown
Institut National des Sciences Agronomiques / Vien Khoa Hoc Ky Thuat Nong Nghiep,Vietnam,Ha Son Binh,Unknown
Institut de Géographie,Vietnam,Hanoi - Nghia Do Tu Liem,Unknown
Institute of Oceanography,Vietnam,Nha Trang,Unknown
Hanoi National Pedagogic University,Vietnam,Hanoi,Unknown
Ho Chi Minh City University of Technology,Vietnam,Ho Chi Minh City,Unknown
Center for Social Sciences for Health,Vietnam,Hanoi City,Unknown
National Center for Natural Science and Technology,Vietnam,Hanoi,Unknown
"Institute of Malariology, Parasitology & Entomology",Vietnam,Hanoi,Unknown
First Pediatric Hospital of Ho Chi Minh City,Vietnam,Ho Chi Minh City,Unknown
Ha Noi College of Pharmacy,Vietnam,Ha Noi,Unknown
Cantho University,Vietnam,Cantho City,Unknown
Institute of Agricultural Science of South Vietnam,Vietnam,Ho Chi Minh City,Unknown
Vietnam Agricultural Science Institute,Vietnam,Hanoi,Unknown
"Centre for Marine Environment Survey, Research and Consultation",Vietnam,Vien Co Hoc,Unknown
Institute of Vaccines and Biological Substances,Vietnam,58 Nha Trang,Unknown
Institute of Agricultural Genetics,Vietnam,Hanoi,Unknown
HANOI AGRICULTURAL UNIVERSITY,Vietnam,HANOI,Unknown
RESEARCH INSTITUTE OF MARINE PRODUCTS,Vietnam,HAIPHONG,Unknown
INSTITUTE FOR FISHERIES ECONOMICS AND PLANNUNG UNDER MINISTRY OF FISHERIES,Vietnam,HANOI,Unknown
CANTHO UNIVERSITY,Vietnam,CAN THO,Unknown
HANOI NATIONAL PEDAGOGIC UNIVERSITY,Vietnam,HANOI,Unknown
UNIVERSITY OF CAN THO,Vietnam,CAN THO,Unknown
NATIONAL CENTRE FOR SOCIAL SCIENCES AND HUMANITIES,Vietnam,HANOI,Unknown
NATIONAL CENTER FOR NATURAL SCIENCE AND TECHNOLOGY,Vietnam,HANOI,Unknown
DEPARTMENT OF DYKE MANAGEMENT AND FLOOD AND STORM CONTROL,Vietnam,HANOI,Unknown
"NATIONAL INSTITUTE OF MALARIOLOGY, PARASITOLOGY & ENTOMOLOGY",Vietnam,HANOI,Unknown
HEALTH STRATEGY AND POLICY INSTITUTE,Vietnam,HANOI,Unknown
RESEARCH INSTITUTE FOR AQUACULTURE NO. 1,Vietnam,TU SON BAC NINH,Unknown
"UNIVERSITY OF SOCIAL SCIENCES AND HUMANITIES, VIETNAM NATIONAL UNIVERSITY",Vietnam,HO CHI MINH CITY,Unknown
CENTER FOR NATURAL RESOURCES AND ENVIRONMENTAL STUDIES - VIETNAM NATIONAL UNIVERSITY,Vietnam,HANOI,Unknown
INSTITUT PASTEUR HO CHI MINH CITY - VIETNAM,Vietnam,HO CHI MINH CITY,Unknown
DEPARTEMENT DES SCIENCES AGRAIRES - INSTITUT NATIONAL DES SCIENCES AGRONOMIQUES DU VIETNAM,Vietnam,HANOI,Unknown
NATIONAL INSTITUTE FOR SOILS AND FERTILIZERS,Vietnam,HANOI,Unknown
VIETNAM ENVIRONMENT AND SUSTAINABLE DEVELOPMENT INSTITUTE,Vietnam,HANOI,Unknown
CUU LONG DELTA RICE RESEARCH INSTITUTE,Vietnam,CANTHO PROVINCE,Unknown
THE NATIONAL INSTITUTE OF HYGIENE AND EPIDEMIOLOGY,Vietnam,HANOI,Unknown
THE UNIVERSITY OF AGRICULTURE AND FORESTRY,Vietnam,HO CHI MINH CITY,Unknown
THE INSTITUTE OF SOCIOLOGY,Vietnam,HANOI,Unknown
TRUONG DAI HOC BACH KHOA HANOI - HANOI UNIVERSITY OF SCIENCE AND TECHNOLOGY HUST,Vietnam,HANOI,Unknown
THE COMPANY FOR VACCINE AND BIOLOGICAL PRODUCTION NO. 1,Vietnam,HANOI,Unknown
NATIONAL INSTITUTE OF HYGIENE AND EPIDEMIOLOGY,Vietnam,HANOI,Unknown
NATIONAL INSTITUTE OF VETERINARY RESEARCH,Vietnam,HA NOI,Unknown
"HANOI AGRICULTURAL UNIVERSITY, FACULTY OF LAND RESOURCES AND ENVIRONMENT",Vietnam,HA NOI,Unknown
CAN THO UNIVERSITY,Vietnam,CAN THO CITY,Unknown
HANOI SCHOOL OF PUBLIC HEALTH,Vietnam,HANOI,Unknown
HUE COLLEGE OF ECONOMICS - HUE UNIVERSITY,Vietnam,HUE CITY,Unknown
INSTITUTE OF GEOGRAPHY/VAST,Vietnam,HANOI,Unknown
"NATIONAL CENTER FOR VETERINARY DIAGNOSIS, DEPARTMENT OF ANIMAL HEALTH",Vietnam,HANOI,Unknown
CAN THO UNIVERSITY,Vietnam,CANTHO CITY,Unknown
"HEALTH POLICY UNIT, DEPARTMENT OF PLANNING AND FINANCE, MINISTRY OF HEALTH, VIETNAM",Vietnam,HANOI,Unknown
"HEALTH STRATEGY AND POLICY INSTITUTE, MINISTRY OF HEALTH, VIETNAM",Vietnam,HANOI,Unknown
VIETNAM AGRICULTURAL SCIENCE INSTITUTE,Vietnam,HA NOI,Unknown
THE HOSPITAL FOR TROPICAL DISEASES VIET NAM,Vietnam,HO CHI MINH CITY,Unknown
HANOI SCHOOL OF PUBLIC HEALTH,Vietnam,HA NOI,Unknown
CAN THO UNIVERSITY,Vietnam,CAN THO PROVINCE,Unknown
INSTITUTE OF ENVIRONMENTAL TECHNOLOGY/NCST,Vietnam,HANOI,Unknown
HANOI UNIVERSITY OF SCIENCE,Vietnam,HANOI,Unknown
INSTITUT PASTEUR DE HO CHI MINH VILLE,Vietnam,HO CHI MINH CITY,Unknown
CENTRE FOR NATURAL RESOURCES AND ENVIRONMENTAL STUDIES/VIETNAM NATIONAL UNIVERSITY,Vietnam,HANOI,Unknown
NATIONAL CENTER FOR SCIENTIFIC AND TECHNOLOGICAL INFORMATION - NACESTI,Vietnam,HANOI,Research Organisations
VIEN VE SINH DICH TE TRUNG UONG,Vietnam,HANOI,Higher or Secondary Education Establishments
INSTITUTE OF ECOLOGY AND BIOLOGICAL RESOURCES VIETNAMESE ACADEMY OF SCIENCE AND TECHNOLOGY,Vietnam,HANOI,Higher or Secondary Education Establishments
Research Centre for Forest Ecology and Environment,Vietnam,Hanoi,Private for-profit entities (excluding Higher or Secondary Education Establishments)
TRUNG TAM SINH THAI NONG NGHIEP,Vietnam,HANOI,Research Organisations
HANOI SCHOOL OF PUBLIC HEALTH,Vietnam,HANOI,Higher or Secondary Education Establishments
MINISTRY OF SCIENCE AND TECHNOLOGY,Vietnam,HANOI,Public bodies (excluding Research Organisations and Secondary or Higher Education Establishments)
Institut de la Francophonie pour l'Informatique,Vietnam,Hanoi,Higher or Secondary Education Establishments
HO CHI MINH CITY INSTITUTE OF INFORMATION TECHNOLOGY,Vietnam,HO CHI MINH CITY,Public bodies (excluding Research Organisations and Secondary or Higher Education Establishments)
Chi Le-Ha,Vietnam,Ho Chi Minh City,Private for-profit entities (excluding Higher or Secondary Education Establishments)
Hanoi University of Technology,Vietnam,Hanoi,Other
VAN LANG UNIVERSITY,Vietnam,HO CHI MINH CITY,Higher or Secondary Education Establishments
Q&A HA NOI CONG TY TNHH,Vietnam,HANOI,Private for-profit entities (excluding Higher or Secondary Education Establishments)
HOC VIEN NONG NGHIEP VIET NAM,Vietnam,HANOI,Higher or Secondary Education Establishments
VIEN KHOA HOC VAT LIEU,Vietnam,HANOI,Research Organisations
VIEN CONG NGHE HOA HOC - VIEN KHOA HOC VA CONG NGHE VIETNAM,Vietnam,HO CHI MINH,Research Organisations
MINISTRY OF AGRICULTURE AND RURAL DEVELOPMENT,Vietnam,Hanoi,Public bodies (excluding Research Organisations and Secondary or Higher Education Establishments)
Hanoi Medical University,Vietnam,HANOI,Higher or Secondary Education Establishments
CONG TY CO PHAN RCEE-NIRAS (UTRO from CONG TY CO PHAN NANG LUONG VA MOI TRUONG RCEE),Vietnam,HANOI,Unknown
HIEP THANH SEAFOOD JOINTSTOCK COMPANY,Vietnam,CAN THO,Unknown
CONG TY CO PHAN AF CONG NGHIEP,Vietnam,HANOI,Unknown
TRUNG TAM TIET KIEM NANG LUONG THANH PHO HO CHI MINH,Vietnam,HOCHIMINH,Unknown
VIEN NGHIEN CUU NUOI TRONG THUY SAN1,Vietnam,TU SON BAC NINH,Research Organisations
NATIONAL COUNCIL FOR SCIENCE AND TECHNOLOGY POLICY,Vietnam,HANOI,Research Organisations
RESEARCH AND DEVELOPMENT CENTER FOR COMMUNITY HEALTH STRATEGY,Vietnam,HANOI,Research Organisations
MINISTRY OF HEALTH OF VIETNAM,Vietnam,Hanoi,Public bodies (excluding Research Organisations and Secondary or Higher Education Establishments)
NATIONAL INSTITUTE OF VETERINARY RESEARCH,Vietnam,HANOI,Research Organisations
National Institute for Agricultural Planning and Projection,Vietnam,HANOI,Research Organisations
Institute of Marine Environments and Resources,Vietnam,Haiphong,Higher or Secondary Education Establishments
VIEN CONG NGHE SINH HOC VA THUC PHAM,Vietnam,HANOI,Higher or Secondary Education Establishments
"Hanoi University of Science, Vietnam National University Hanoi",Vietnam,Hanoi,Higher or Secondary Education Establishments
VIEN CONG NGHE THONG TIN,Vietnam,HANOI,Higher or Secondary Education Establishments
