name,country,city,businessType
VORONEZH STATE UNIVERSITY,Russia,VORONEZH,Unknown
"INSTITUTE FOR SYSTEMS ANALYSIS, RUSSIAN ACADEMY OF SCIENCES",Russia,MOSCOW,Unknown
"FEDERAL STATE UNITARY ENTERPRISE CENTRAL AEROHYDRODYNAMIC INSTITUTE, N.A. N.E. ZHUKOVSKY",Russia,"ZHUKOVSKY, MOSCOW REGION",Unknown
EDUCATIONAL SCIENTIFIC AND EXPERIMENTAL CENTER OF MOSCOW INSTITUTE OF PHYSICS AND TECHNOLOGY,Russia,"DOLGOPRUDNY, MOSCOW REG.",Unknown
SHEMYAKIN & OVCHINNIKOV INSTITUTE OF BIOORGANIC CHEMISTRY RUSSIAN ACADEMY OF SCIENCE,Russia,MOSCOW,Unknown
INSTITUTE FOR EXPERIMENTAL MEDICINE - RUSSIAN ACADEMY OF MEDICAL SCIENCES,Russia,SAINT-PETERSBURG,Unknown
INSTITUTE OF INTERNAL MEDICINE SB RAMS,Russia,NOVOSIBIRSK,Unknown
A.N. BAKH INSTITUTE OF BIOCHEMISTRY OF THE RUSSIAN ACADEMY OF SCIENCE,Russia,MOSCOW,Unknown
"RUSSIAN RESEARCH CENTRE ""KURCHATOV INSTITUTE""",Russia,MOSCOW,Unknown
"LASER CHEMISTRY LABORATORY, RUSSIAN ACADEMY OF SCIENCES",Russia,TROITSK,Unknown
ASSOCIATION FOR ENGINEERING EDUCATION OF RUSSIA,Russia,MOSCOW,Unknown
"RUSSIAN CANCER SOCIETY, RUSSIAN ACADEMY MEDICAL SCIENCES, RUSSIAN NN BLOKHIN CANCER CENTRE",Russia,MOSCOW,Unknown
"RESEARCH INSTITUTE OF CARDIOLOGY, TOMSK RESEARCH CENTRE, RUSSIAN ACADEMY OF MEDICAL SCIENCES",Russia,TOMSK,Unknown
"STATE INSTITUTION OF PUBLIC HEALTH SERVICE, ALTAI ONCOLOGICAL CENTRE",Russia,BARNAUL,Unknown
RUSSIAN FEDERAL RESEARCH INSTITUTE FOR FISHERIES AND OCEANOGRAPHY,Russia,MOSCOW,Unknown
SIBERIAN SCIENTIFIC RESEARCH & PROJECTING INSTITUTE OF RATIONAL NATURE MANAGEMENT,Russia,NIZHNEVARTOVSK,Unknown
CENTER OF RECULTIVATION RUSECOSYSTEM,Russia,NIZHNEVARTOVSK,Unknown
KNIPOVICH POLAR RESEARCH INSTITUTE OF MARINE FISHERIES AND OCEANOGRAPHY,Russia,MURMANSK,Unknown
INSTITUTION OF THE RUSSIAN ACADEMY OF SCIENCES THE SOUTHERN SCIENTIFIC CENTRE RAS,Russia,ROSTOV-ON-DON,Unknown
INSTITUTE OF LASER AND INFORMATION TECHNOLOGIES RUSSIAN ACADEMY OF SCIENCES,Russia,"SHATURA, MOSCOW REGION",Unknown
PETERSBURG NUCLEAR PHYSICS INSTITUTE OF THE RUSSIAN ACADEMY OF SCIENCES,Russia,"GATCHINA, ST-PETERSBURG",Unknown
"NIKOLAEV INSTITUTE OF INORGANIC CHEMISTRY, SIBERIAN BRANCH OF RUSSIAN ACADEMY OF SCIENCES",Russia,NOVOSIBIRSK,Unknown
"INSTITUTE OF SOLID STATE PHYSICS, RUSSIAN ACADEMY OF SCIENCES",Russia,CHERNOGOLOVKA,Unknown
SAINT-PETERSBURG STATE UNIVERSITY,Russia,,Unknown
"FEDERAL STATE UNITARY ENTERPRISE ""STATE INSTITUTE FOR GENETICS AND SELECTION OF INDUSTRIAL MICROORGANISMS""",Russia,MOSCOW,Unknown
MOSCOW POWER ENGINEERING INSTITUTE (TECHNICAL UNIVERSITY),Russia,MOSCOW,Unknown
"ST.-PETERSBURG STATE UNIVERSITY OF INFORMATION TECHNOLOGIES, MECHANICS AND OPTICS",Russia,ST. PETERSBURG,Unknown
SAINT-PETERSBURG STATE UNIVERSITY,Russia,SAINT-PETERSBURG,Unknown
INSTITUTE OF ATMOSPHERIC OPTICS OF SIBERIAN BRANCH OF THE RUSSIAN ACADEMY OF SCIENCE,Russia,,Unknown
WATER PROBLEMS INSTITUTE OF RUSSIAN ACADEMY OF SCIENCES,Russia,Moscow,Unknown
SOBOLEV INSTITUTE OF MATHEMATICS SIBERIAN BRANCH OF RUSSIAN ACADEMY OF SCIENCES,Russia,NOVOSIBIRSK,Unknown
"RUSSIAN ACADEMY INSTITUTE OF GENERAL PHYSICS, RUSSIAN ACADEMY OF SCIENCES",Russia,MOSCOW,Unknown
A.V. TOPCHIEV INSTITUTE OF PETROCHEMICAL SYNTHESIS - RUSSIAN ACADEMY OF SCIENCES,Russia,MOSCOW,Unknown
FEDERAL STATE UNITARY ENERPRISE ALL-RUSSIAN RAILWAY RESEARCH INSTITUTE,Russia,MOSCOW,Unknown
JOINT STOCK COMPANY RAILWAY RESEARCH INSTITUTE,Russia,MOSCOW,Unknown
"BORESKOV INSTITUTE OF CATALYSIS, SIBERIAN BRANCH OF RUSSIAN ACADEMY OF SCIENCES",Russia,NOVOSIBIRSK,Unknown
FEDERAL STATE UNITARY ENTERPRISE CENTRAL AEROHYDRODYNAMICS INSTITUTE,Russia,ZHUKOVSKY,Unknown
INSTITUTE OF GEOSPHERES DYNAMICS OF RUSSIAN ACADEMY OF SCIENCES,Russia,MOSCOW,Unknown
INSTITUTE OF BIOLOGY OF KOMI SCIENTIFIC CENTER OF THE URAL BRANCH OF THE RUSS,Russia,SYKTYVKAR,Unknown
MARKETING CENTER ARENA-S,Russia,SYKTYVKAR,Unknown
"MOSCOW STATE UNIVERSITY, FACULTY OF PHYSICS",Russia,MOSCOW,Unknown
INSTITUTE OF SOLID STATE PHYSICS OF THE RUSSIAN ACADEMY OF SCIENCES,Russia,CHERNOGOLOVKA,Unknown
BUDKER INSTITUTE OF NUCLEAR PHYSICS,Russia,NOVOSIBIRSK,Unknown
INSTITUTE OF HIGH CURRENT ELECTRONICS SB RAS,Russia,TOMSK,Unknown
INSTITUTE FOR NUCLEAR RESEARCH OF THE RUSSIAN ACADEMY OF SCIENCE,Russia,MOSCOW,Unknown
"LIMITED LIABILITY COMPANY ""MODERN REFRIGERATION TECHNOLOGIES - VELIS REFRIGERATION""",Russia,MOSCOW,Unknown
"INSTITUTE OF PLANT AND ANIMAL ECOLOGY OF THE RUSSIAN ACADEMY OF SCIENCES, URAL DIVISION",Russia,EKATERINBURG,Unknown
METEOROLOGICAL SYNTHESIZING CENTRE - EAST OF THE CO-OPERATIVE PROGRAMME FOR MONITORING AND EVALUATION OF THE LONG-RANGE TRANSMISSION OF AIR POLLUTANTS IN EUROPE,Russia,MOSCOW,Unknown
NATURAL SCIENCES CENTER OF A.M. PROKHOROV GENERAL PHYSICS INSTITUTE OF RUSSIAN ACADEMY OF SCIENCES,Russia,MOSCOW,Unknown
RUSSIAN STATE AGRARIAN UNIVERSITY - TIMIRYAZEV ACADEMY,Russia,MOSCOW,Unknown
ZOOLOGICAL INSTITUTE OF RUSSIAN ACADEMY OF SCIENCES,Russia,SINT PETERSBURG,Unknown
THE INSTITUTE FOR PROBLEMS IN MECHANICS RUSSIAN ACADEMY OF SCIENCES,Russia,MOSCOW,Unknown
ZIMTEC,Russia,MOSCOW,Unknown
CENTRAL ASTRONOMICAL OBSERVATORY OF THE RUASSIAN ACADEMY OF SCIENCES,Russia,SAINT-PETERSBURG,Unknown
INTERNATIONAL TOMOGRAPHY CENTER OF SIBERIAN DIVISION OF RUSSIAN ACADEMY OF SCIENCES,Russia,NOVOSIBIRSK,Unknown
NPO SATURN JOINT STOCK COMPANY,Russia,"RYBINSK, YAROSLAVL REGION",Unknown
SIGMA TECHNOLOGY,Russia,MOSCOW,Unknown
BORESKOV INSTITUTE OF CATALYSIS OF THE SIBERIAN BRANCH OF THE RUSSIAN ACADEMY OF SCIENCES,Russia,NOVOSIBIRSK,Unknown
SOUTH RUSSIAN REGIONAL CENTRE FOR PREPARATION AND IMPLEMENTATION OF INTERNATIONAL PROJECTS CPPI-S LTD,Russia,ROSTOV-ON-DON,Unknown
NATURAL RESOURCES CENTRE,Russia,ROSTOV-ON-DON,Unknown
BORESKOV INSTITUTE OF CATALYSIS,Russia,NOVOSIBIRSK,Unknown
RUSSIAN STATE SCIENTIFIC CENTER INSTITUTE FOR THEORETICAL AND EXPERIMENTAL PHYSICS,Russia,MOSCOW,Unknown
LIMNOLOGICAL INSTITUTE OF THE SIBERIAN BRANCH OF THE RUSSIAN ACADEMY OF SCIENCES,Russia,ITKUTSK,Unknown
RUSSIAN FEDERAL RESEARCH INSTITUTE OF FISHERIES AND OCEANOGRAPHY,Russia,MOSCOW,Unknown
FEDERAL CENTER OF FISH GENETICS AND SELECTION (MOSCOW BRANCH),Russia,MOSCOW,Unknown
INTEL A/O,Russia,MOSCOW,Unknown
"LANDAU INSTITUTE FOR THEORETICAL PHYSICS, RUSSIAN ACADEMY OF SCIENCES",Russia,"CHERNOGOLOVKA, MOSCOW REGION",Unknown
ELECARD DEVICES ZAO,Russia,TOMSK,IND
INSTITUTION FOR RESEARCH AND EDUCATION SAINT-PETERSBURG PHYSICO-TECHNICAL CENTRE FOR RESEARCH AND EDUCATION OF THE RUSSIAN ACADEMY OF SCIENCES,Russia,SAINT-PETERSBURG,Research Organisations
CENTRE FOR ECONOMIC AND FINANCIAL RESEARCH (CEFIR),Russia,MOSCOW,Unknown
INSTITUTE FOR THE STUDY OF SCIENCE IN THE RUSSIAN ACADEMY OF SCIENCES,Russia,MOSCOW,Unknown
IOFFE PHYSICO-TECHNICAL INSTITUTE OF THE RUSSIAN ACADEMY OF SCIENCES,Russia,ST. PETERSBURG,Unknown
INSTITUTE OF RADIO ENGINEERING AND ELECTRONICS RUSSIAN ACADEMY OF SCIENCES,Russia,MOSCOW,Unknown
"INSTITUTE OF BIOLOGY, KOMI SCIENTIFIC CENTER, URAL BRANCH OF THE RUSSIAN ACADEMY OF SCIENCES",Russia,SYKTYVKAR,Unknown
"INSTITUTE OF TERRESTRIAL MAGNETISM, IONOSPHERE AND RADIOWAVES PROPAGATION, ST.PETERSBURG BRANCH RAS",Russia,SAINKT-PETERSBURG,Unknown
POLAR-ALPINE BOTANICAL GARDEN-INSTITUTE,Russia,APATITY,Unknown
STATE HYDROLOGICAL INSTITUTE,Russia,ST.PETERSBURG,Unknown
THE BAUMAN MOSCOW STATE TECHNICAL UNIVERSITY,Russia,MOSCOW,Unknown
SOCIOLOGICAL INSTITUTE RUSSIAN ACADEMY OF SCIENCE,Russia,ST. PETERSBURG,Unknown
RUSSIAN TECHNOLOGY TRANSFER NETWORK,Russia,OBNINSK,Unknown
INSTITUTE FOR SYSTEM PROGRAMMING OF RUSSIAN ACADEMY OF SCIENCES,Russia,MOSCOW,Unknown
ST. Petersburg Insitute for Informatics and Automation of the Russian Academy of Science,Russia,ST.PETERSBURG,Unknown
BIOANALYTICAL TECHNOLOGIES,Russia,MOSCOW,Unknown
SMW ENGINEERING LTD.,Russia,ST. PETERSBURG,Unknown
INSTITUTE OF THERMAL PHYSICS,Russia,EKATERINBURG,Unknown
KOMAROV BOTANICAL INSTITUTE OF THE RUSSIAN ACADEMY OF SCIENCES,Russia,SINT PETERSBURG,Unknown
ARCTIC AND ANTARCTIC RESEARCH INSTITUTE OF ROSHYDROMET - STATE RESEARCH CENTER OF RUSSIAN FEDERATION,Russia,SAINT PETERSBURG,Unknown
INSTITUTE OF NUMERICAL MATHEMATICS - RUSSIAN ACADEMY OF SCIENCES,Russia,MOSCOW,Unknown
NANSEN INTERNATIONAL ENVIRONMENTAL AND REMOTE SENSING CENTER,Russia,SAINT PETERSBURG,Unknown
ELECTROGORSK RESEARCH AND ENGINEERING CENTER ON NUCLEAR POWER PLANTS SAFETY,Russia,ELECTROGORSK,Unknown
EXPERIMENTAL AND DESIGN ORGANIZATION GIDROPRESS,Russia,PODOLSK,Unknown
STATE RUSSIAN MUSEUM,Russia,SAINT-PETERSBOURG,Unknown
INSTITUTE FOR HIGH PERFORMANCE COMPUTING AND INFORMATION SYSTEMS,Russia,SAINT PETERSBURG,Unknown
"FEDERAL STATE UNITARY ENTERPRISE ""ALL-RUSSIAN SCIENTIFIC-RESEARCH INSTITUTE OF AVIATION MATERIALS""",Russia,MOSCOW,Unknown
FEDERAL STATE UNITARY ENTERPRISE CENTRAL AEROHYDRODYNAMIC INSTITUTE N.A. PROF. N.E. ZHUKOVSKY,Russia,"ZHUKOVSKY, MOSCOW REG.",Unknown
EDUCATIONAL SCIENTIFIC AND EXPERIMENTAL CENTER OF MOSCOW INSTITUTE OF PHYSICS AND TECHNOLOGY,Russia,"DOLGOPRUDNY, MOSCOW REG",Unknown
CENTRAL AEROLOGICAL OBSERVATORY,Russia,DOLGOPRUDNY,Unknown
"M. P. CHUMAKOV INSTITUTE OF POLIOMYELITIS AND VIRAL ENCEPHALITIDES, RUSSIAN ACADEMY OF MEDICAL SCIENCE (RAMSC)",Russia,MOSCOW REGION,Unknown
ST. PETERSBURG INSTITUTE FOR INFORMATICS AND AUTOMATION OF THE RUSSIAN ACADEMY OF SCIENCE,Russia,ST. PETERSBURG,Unknown
NATIONAL RESEARCH CENTER FOR HEMATOLOGY,Russia,MOSCOW,Unknown
ST. PETERSBURG STATE PAVLOV MEDICAL UNIVERSITY,Russia,ST. PETERSBURG,Unknown
"FEDERAL STATE ISTITUTION CENTRE FOR HEART, BLOOD AND ENDOCRINOLOGY NAMED AFTER V. A. ALMAZOV",Russia,ST. PETERSBURG,Unknown
"STATE INSTITUTION OF HEALTHCARE ""REGIONAL CHRILDREN'S HOSPITAL # 1""",Russia,YEKATERINBURG,Unknown
RUSSIAN RESEARCH INSTITUTE OF HEMATOLOGY AND TRANSFUSIOLOGY,Russia,SAINT-PETERSBURG,Unknown
ROSTOV STATE MEDICAL UNIVERSITY,Russia,ROSTOV-ON-DON,Unknown
INSTITUTE OF THEORETICAL AND APPLIED MECHANICS,Russia,NOVOSIBIRSK,Unknown
ARCTIC AND ANTARCTIC RESEARCH INSTITUTE OF ROSHYDROMET - STATE RESEARCH CENTER OF RUSSIAN FEDERATION,Russia,ST PETERSBERG,Unknown
ALL-RUSSIAN RESEARCH INSTITUTE OF PLANT PROTECTION,Russia,SAINT-PETERSBURG,Unknown
SIBERIAN STATE MEDICAL UNIVERSITY,Russia,TOMSK,Unknown
GEO-ZUP COMPANY,Russia,"KOROLYOV, MOSCOW REG.",Unknown
XJ TECHNOLOGY COMPANY LTD,Russia,ST PETERSBURG,Unknown
INSTITUTE OF MICROELECTRONICS TECHNOLOGY - RUSSIAN ACADEMY OF SCIENCES,Russia,CHERNOGOLOVKA,Unknown
AUTONOMOUS NON-COMMERCIAL ORGANISATION CENTRE FOR ORTHOPAEDY AND MEDICAL MATERIAL SCIENCES,Russia,TOMSK,Unknown
INSTITUTE OF MATHEMATICAL PROBLEMS OF BIOLOGY - RUSSIAN ACADEMY OF SCIENCES,Russia,PUSHCHINO,Unknown
CONCERN SCIENTIFIC - PRODUCTION ASSOCIATION BIOTECHNIKA LTD,Russia,TOMSK,Unknown
STATE UNIVERSITY HIGHER SCHOOL OF ECONOMICS,Russia,MOSCOW,Unknown
INSTITUTE OF STRUCTURAL MACROKINETICS AND MATERIALS SCIENCE RAS,Russia,CHERNOGOLOVKA,Unknown
LNSTITUTE OF CHEMICAL PROBLEMS FOR MICROELECTRONICS,Russia,MOSCOW,Unknown
UFA STATE AVIATION TECHNICAL UNIVERSITY,Russia,UFA,Unknown
VICEVERSA CONSULTING,Russia,EKATERINBURG,Unknown
SAINT-PETERSBURG STATE POLYTECHNIC UNIVERSITY,Russia,SAINT-PETERSBURG,Unknown
RUSSIAN SME RESOURCE CENTRE FUND,Russia,MOSCOW,Unknown
OOO EUROPEAN BUSINESS KONSULTANT,Russia,MOSCOWL,Unknown
"MOSCOW STATE UNIVERSITY OF ECONOMICS, STATISTICS AND INFORMATICS",Russia,MOSCOW,Unknown
"NONCOMMERCIAL PARTNERSHIP ""THE EUROPEAN HOUSE FOR DEVELOPMENT OF BUSINESS, PUBLIC, POLITICAL, SOCIAL AND CULTURAL TIES""",Russia,MOSCOW,Unknown
OLIGOPHARM CO LTD,Russia,NIZHNI NOVGOROD,Unknown
ZOOLOGICAL INSTITUTE OF THE RUSSIAN ACADEMY OF SCIENCES,Russia,ST. PETERSBURG,Unknown
"INSTITUTE OF CYTOLOGY AND GENETICS, SIBERIAN BRANCH OF RUSSIAN ACADEMY OF SCIENCES",Russia,NOVOSIBIRSK,Unknown
ST. PETERSBURG ELECTROTECHNICAL UNIVERSITY,Russia,ST. PETERSBURG,Unknown
MOSCOW STATE TECHNOLOGICAL UNIVERSITY,Russia,MOSCOW,Unknown
FEDERAL STATE UNITARY ENTERPRISE AEROHYDRODYNAMIC INSTITUTE,Russia,"ZHUKOVSKY, MOSCOW REG",Unknown
"BIOTEST, COOPERATIVE ENTERPRISE FOR RESEARCH & PRODUCTION",Russia,KIRISHI,Unknown
"MOSCOW LOMONOSOV STATE UNIVERSITY, BIOLOGICAL FACULTY",Russia,MOSCOW,Unknown
MOSCOW STATE UNIVERSITY OF RIALWAY ENGINEERING,Russia,MOSCOW,Unknown
CENTER BIOENGINEERING RAS,Russia,MOSCOW,Unknown
INSTITUTE OF CONTROL SCIENCES OF THE RUSSIAN ACADEMY OF SCIENCES,Russia,MOSCOW,Unknown
FEDERAL STATE UNITARY ENTERPRISE CENTRAL AEROHYDRODYAMIC INSTITUTE,Russia,ZHUKOVSKY,Unknown
KHRISTIANOVICH INSTITUTE OF THEORETICAL AND APPLIED MECHANICS SB RAS,Russia,NOVOSIBIRSK,Unknown
RESEARCH CENTER FOR EARTH OPERATIVE MONITORING,Russia,MOSCOW,Unknown
"IRKUTSK SCIENCE CENTER, SIBERIAN BRANCH OF RUSSIAN ACADEMY OF SCIENCE",Russia,IRKUTSK,Unknown
"""NANSEN INTERNATIONAL ENVIRONMENTAL AND REMOTE SENSING CENTER""",Russia,ST.PETERSBURG,Unknown
"FEDERAL STATE UNITARY ENTERPRISE ""RUSSIAN INSTITUTE OF SPACE DEVICE ENGINEERING""",Russia,MOSCOW,Unknown
ALL RUSSIA RESEARCH INSTITUTE FOR AGRICULTURAL MICROBIOLOGY,Russia,ST. PETERSBURG,Unknown
RUSSIAN MARITIME REGISTER OF SHIPPING,Russia,SANKT-PETERSBURG,Unknown
NORTHERN RESEARCH INSTITUTE OF FORESTRY,Russia,ARKHANGELSK,Unknown
STATE UNIVERSITY OF ST.PETERSBURG,Russia,ST. PETERSBURG,Unknown
"FEDERAL STATE INSTITUTION ""TECHNOLOGICAL INSTIUTE FOR SUPERHARD AND NOVEL CARBON MATERIALS""",Russia,"TROITSK, MOSCOW REGION",Unknown
INSTITUTE OF BIOCHEMICAL PHYSICS OF RUSSIAN ACADEMY OF SCIENCES,Russia,MOSCOW,Unknown
"CENTER CORTES, LTD",Russia,MOSCOW,Unknown
"INTERNATIONAL INSTITUTE OF EARTHQUAKE PREDICTION THEORY AND MATHEMATICAL GEOPHYSICS, RUSSIAN ACADEMY OF SCIENCES",Russia,MOSCOW,Unknown
"INSTITUTE OF CRYSTALLOGRAPHY, RUSSIAN ACADEMY OF SCIENCES",Russia,MOSCOW,Unknown
V.L.LL'ICHEV PACIFIC OCEANOLOGICAL INSTITUTE,Russia,VLADIVOSTOK,Unknown
ASTRAKHAN STATE TECHNICAL UNIVERSITY,Russia,ASTRAKHAN,Unknown
INSTITUTE FOR GLOBALIZATION STUDIES,Russia,MOSCOW,Unknown
"NTVP ""POVERKHNOST"" OOO (SURFACE PHENOMENA RESEARCHES GROUP LLC)",Russia,MOSCOW,Unknown
DESIGN BUREAU THERMOPLANE,Russia,MOSCOW,Unknown
INSTITUTE OF THEORETICAL & APPLIED MECHANICS,Russia,NOVOSIBIRSK,Unknown
SUKHOI CIVIL AIRCRAFT,Russia,MOSCOW,Unknown
FEDERAL STATE UNITARY ENTERPRISE CENTRAL AEROHYDRODYNAMIC INSTITUTE,Russia,"ZHUKOVSKY, MOSCOW REG.",Unknown
ALL-RUSSIAN RESEARCH INSTITUTE FOR CIVIL DEFENSE AND EMERGENCIES,Russia,MOSCOW,Unknown
INSTITUTE OF MONITORING OF CLIMATIC AND ECOLOGICAL SYSTEMS,Russia,TOMSK,Unknown
"INSTITUTE FOR NUMERICAL MATHEMATICS, RUSSIAN ACADEMY OF SCIENCES",Russia,MOSCOW,Unknown
"V.N. SUKACHEV INSTITUTE OF FOREST, SIBERIAN BRUNCH, RUSSIAN ACADEMY OF SCIENSES",Russia,KRASNOYARSK,Unknown
UGRA RESEARCH INSTITUTE OF INFORMATIONAL TECHNOLOGIES,Russia,KHANTY-MANSYISK,Unknown
INSTITUTE OF COMPUTATIONAL MATHEMATICS AND MATHEMATICAL GEOPHYSICS SB RAS,Russia,NOVOSIBIRSK,Unknown
PROMTRAK LTD,Russia,KINGISEPP,Unknown
MENDELEEV UNIVERSITY OF CHEMICAL TECHNOLOGY OF RUSSIA,Russia,MOSCOW,Unknown
STATE SCIENTIFIC RESEARCH INSTITUTE OF EXTRA PURE SUBSTANCES AND REACTANTS,Russia,MOSCOW,Unknown
ST. PETERSBURG STATE TECHNOLOGICAL INSTITUTE (TECHNICAL UNIVERSITY),Russia,ST PETERSBURG,Unknown
M.V.LOMONOSOV MOSCOW STATE UNIVERSITY,Russia,MOSCOW,Unknown
WATER PROBLEM INSTITUTE OF RUSSIAN ACADEMY OF SCIENCES,Russia,MOSCOW,Unknown
"INSTITUTE OF RADIO ENGINEERING AND ELECTRONICS, RUSSIAN ACADEMY OF SCIENCES",Russia,MOSCOW,Unknown
"INSTITUTE FOR THEORETICAL AND APPLIED ELECTRODYNAMICS, RUSSIAN ACADEMY OF SCIENCES",Russia,MOSCOW,Unknown
PETERSBURG NUCLEAR PHYSICS INSTITUTE - RUSSIAN ACADEMY OF SCIENCE,Russia,GATCHINA,Unknown
"RUSSIAN RESEARCH CENTER ""KURCHATOV INSTITUTE""",Russia,MOSCOW,Unknown
NANOTECHNOLOGY-MDT CO.,Russia,MOSCOW,Unknown
INSTITUTE FOR PHYSICS OF MICROSTRUCTURES OF RUSSIAN ACADEMY OF SCIENCES (IPMRAS),Russia,NIZHNY NOVGOROD,Unknown
WATER PROBLEMS INSTITUTE OF THE RUSSIAN ACADEMY OF SCIENCES,Russia,MOSCOW,Unknown
ALL-RUSSIA INSTITUTE OF LIGHT ALLOYS,Russia,MOSCOW,Unknown
FEDERAL STATE UNITARY ENTERPRISE ALL RUSSIAN SCIENTIFIC RESEARCH INSTITUTE OF AVIATION MATERIALS,Russia,MOSCOW,Unknown
SMW ENGINEERING LTD.,Russia,ST PETERSBURG,Unknown
A. F. LOFFE PHYSICO-TECHNICAL INSTITUTE,Russia,ST. PETERSBURG,Unknown
RUSSIAN CHRISTIAN ACADEMY FOR HUMANITY,Russia,ST PETERSBURG,Unknown
TECHNICS AND TECHNOLOGY OF DISINTEGRATION LTD.,Russia,ST. PETERSBURG,Unknown
INSTITUTE OF SPECTROSCOPY OF RUSSIAN ACADEMY OF SCIENCE,Russia,TROITSK,Unknown
OREL STATE TECHNICAL UNIVERSITY,Russia,OREL,Unknown
RIGEL BATTERY COMPANY,Russia,SAINT-PETERSBURG,Unknown
RESEARCH INSTITUTE OF MECHANICS OF THE MOSCOW STATE UNIVERSITY M.V. LOMONOSOV,Russia,MOSCOW,Unknown
INSTITUTE OF BIOLOGY OF KOMI SCIENTIFIC CENTER OF THE URAL BRANCH OF THE RUSSIAN ACADEMY OF SCIENCES,Russia,SYKTYVKAR,Unknown
SOIL SCIENCE FACULTY OF MOSCOW LOMONOSSOV STATE UNIVERSITY,Russia,MOSCOW,Unknown
BIOLOGICAL RESEARCH INSTITUTE OF SAINT PETERSBURG STATE UNIVERSITY,Russia,STARY PETERGOF-ST. PETERSBURG,Unknown
INSTITUTE OF PHYSICOCHEMICAL AND BIOLOGICAL PROBLEMS IN SOIL SCIENCE OF RUSSIAN ACADEMY OF SCIENCES,Russia,PUSHCHINO,Unknown
ALL-RUSSSIA THERMAL ENGINEERING INSTITUTE,Russia,MOSKOW,Unknown
INSTITUTE OF MICROELECTRONICS TECHNOLOGY RAS,Russia,CHERNOGOLOVKA,Unknown
PERM STATE UNIVERSITY,Russia,PERM,Unknown
ST PETERSBURG STATE UNIVERSITY,Russia,SAINT PETERSBURG,Unknown
IRKUTSK STATE UNIVERSITY,Russia,IRKUTSK,Unknown
ECOLINE ENVIRONMENTAL ASSESMENT CENTRE,Russia,MOSCOW,Unknown
SARATOV STATE AGRARIAN UNIVERSITY,Russia,SARATOV,Unknown
PHOTOCHEMISTRY CENTER RUSSIAN ACADEMY OF SCIENCES,Russia,MOSCOW,Unknown
RUSSIAN STATE LIBRARY,Russia,MOSCOW,Unknown
INSTITUTE FOR SYSTEMS BIOLOGY SPB COMPANY LIMITED,Russia,SAINT-PETERSBURG,Unknown
GAUSE INSTITUTE OF NEW ANTIBIOTICS,Russia,MOSCOW,Unknown
AUTONOMOUS NON-COMMERCIAL RESEARCH CENTER OF BIOTECHNOLOGY OF ANTIBIOTICS,Russia,MOSCOW,Unknown
VIEN - RENEWABLE ENERGY SOURCES,Russia,MOSCOW,Unknown
ZAO  STCW  SOWENA ,Russia,MOSCOW,Unknown
PUBLIC JOINT STOCK COMPANY INSTITUTE OF SOLAR ENERGY,Russia,ULAN-UDE,Unknown
SOLAR ENERGY CENTER INTERSOLARCENTER,Russia,MOSCOW,Unknown
"INDUSTRIAL DEVELOPMENT INSTITUTE INFORMELECTRO OF THE MINISTRY OF INDUSTRY, SCIENCE AND TECHNOLOGIES OF THE RUSSIAN FEDERATION",Russia,MOSCOW,Unknown
NANSEN INTERNATIONAL ENVIRONMENTAL AND REMOTE SENSING CENTRE,Russia,ST. PETERSBURG,Unknown
"STATE RESEARCH CENTER, INSTITUTE OF IMMUNOLOGY",Russia,MOSCOW,Unknown
SPACE RESEARCH INSTITUTE OF RUSSIAN ACADEMY OF SCIENCE,Russia,MOSCOW,Unknown
EUROPEAN UNIVERSITY AT ST.PETERSBURG,Russia,ST. PETERSBURG,Unknown
SAINT PETERSBURG SCIENTIFIC RESEARCH CENTRE OF ECOLOGICAL SAFETY RUSSIAN ACADEMY OF SCIENCES,Russia,SAINT-PETERSBURG,Unknown
PACIFIC FOREST FORUM,Russia,KHABAROVSK,Unknown
BELOZERSKY INSTITUTE OF PHYSICO-CHEMICAL BIOLOGY LOMONOSOV MOSCOW STATE UNIVERSITY,Russia,MOSCOW,Unknown
STATE RESEARCH CENTRE OF RUSSIAN FEDERATION TROITSK INSTITUTE FOR INNOVATION AND FUSION RESEARCH,Russia,TROITSK,Unknown
A.N. BAKH INSTITUTE OF BIOCHEMISTRY OF THE RUSSIAN ACADEMY OF SCIENCES,Russia,,Unknown
CASPIAN MARINE SCIENTIFIC AND RESEARCH CENTER OF ROSHYDROMET,Russia,ASTRAKHAN,Unknown
ECOLOGICAL PROJECTS CONSULTING INSTITUTE,Russia,MOSCOW,Unknown
INDEPENDENT NON-COMMERCIAL ORGANISATION ENVIRONMENTAL POLICY RESEARCH AND CONSULTING,Russia,MOSCOW,Unknown
SARATOV STATE SOCIO-ECONOMIC UNIVERSITY,Russia,SARATOV,Unknown
"OPEN JOINT-STOCK COMPANY ""AMMOPHOS""",Russia,CHEREPOVEC,Unknown
KOSTROMA CITY ADMINISTRATION,Russia,KOSTROMA,Unknown
"INDEPENDENT NONCOMMERCIAL ORGANIZATION THE RESEARCH INNOVATION PROJECT INSTITUTE ""CADASTRE""",Russia,YAROSLAVL,Unknown
NIZHNY NOVGOROD STATE UNIVERSITY OF ARCHITECTURE AND CIVIL ENGINEERING,Russia,NIZHNY NOVGOROD,Unknown
"AUTONOMOUS NONCOMMERCIAL ORGANISATION (ANO) INSTITUTE OF ENVIRONMENTAL ECONOMICS AND NATURAL RESOURCES ACCOUNTING ""CADASTER""",Russia,YAROSLAV,Unknown
SOUTHERN SCIENTIFIC CENTRE OF THE RUSSIAN ACADEMY OF SCIENCES,Russia,ROSTOV-ON-DON,Unknown
P.P.SHIRSHOV INSTITUTE OF OCEANOLOGY RAS,Russia,MOSCOW,Unknown
HYDROMETEOROLOGICAL RESEARCH CENTER OF RUSSIAN FEDERATION,Russia,MOSCOW,Unknown
INSTITUTE OF CARCINOGENESIS,Russia,MOSCOW,Unknown
"INSTITUTE OF BIOORGANIC CHEMISTRY RUSSIAN ACADEMY OF SCIENCES, RUSSIA",Russia,MOSCOW,Unknown
"INSTITUTE OF ECONOMY, RUSSIAN ACADEMY OF SCIENCES",Russia,MOSCOW,Unknown
"NON-COMMERCIAL ORGANIZATION FOUNDATION FOR ECONOMIC RESEARCH ""DEVELOPMENT CENTER""",Russia,MOSCOW,Unknown
TVER STATE TECHNICAL UNIVERSITY,Russia,TVER,Unknown
N.D. ZELINSKY INSTITUTE OF ORGANIC CHEMISTRY OF THE RUSSIAN ACADEMY OF SCIENCES,Russia,MOSCOW,Unknown
SHIRSHOV INSTITUTE OF OCEANOLOGY - ATLANTIC BRANCH,Russia,KALININGRAD,Unknown
SAINT-PETERSBURG SCIENTIFIC RESEARCH CENTER OF ECOLOGICAL SAFETY,Russia,SAINT-PETERSBURG,Unknown
"RESEARCH AND PRODUCTION ASSOCIATION ""TYPHOON""",Russia,OBNINSK,Unknown
D.V. SKOBELTSYN INSTITUTE OF NUCLEAR PHYSICS AT M.V. LOMONOSOV MOSCOW STATE UNIVERSITY,Russia,MOSCOW,Unknown
FEDERAL STATE UNITARY ENTREPRISE THE CENTRAL AEROHYDRODYNAMIC INSTITUTE NAMED AFTER PROF. N.E. ZHUKOVSKY,Russia,ZHUKOVSKY - MOSCOW REGION,Unknown
N. N. BLOKHIN CANCER RESEARCH CENTER,Russia,MOSCOW,Unknown
"OOO ""DRILLING, ENGINEERING RESEARCH AND COMMUNICATION INSTALLATION""",Russia,MOSCOW,Unknown
"INSTITUTE OF THE INDUSTRIAL ECOLOGY OF THE NORTH, KOLA SCIENCE CENTER, RUSSIAN ACADEMY OF SCIENCES",Russia,"APATITY, MURMANSK REGION",Unknown
"M.V. LOMONOSOV MOSCOW STATE UNIVERSITY, FACULTY OF PHYSICS",Russia,MOSCOW,Unknown
UGRA STATE UNIVERSITY,Russia,KHANTY-MANSIYSK,Unknown
THE STATE UNIVERSITY - HIGHER SCHOOL OF ECONOMICS,Russia,MOSCOW,Unknown
RUSSIAN-AMERICAN ECONOMY AND BUSINESS INSTITUTE AT THE URALS STATE UNIVERSITY,Russia,EKATERINBURG,Unknown
JOINT SUPERCOMPUTER CENTER OF THE RUSSIAN ACADEMY OF SCIENCES,Russia,MOSCOW,Unknown
EDUCATIONAL AND CONSULTING CENTER COMPASS CONSULT,Russia,KALININGRAD,Unknown
KABARDINO-BAKARIAN STATE UNIVERSITY BY H.M. BERBEKOVA,Russia,NALCHIK,Unknown
IZHEVSK STATE TECHNICAL UNIVERSITY,Russia,IZHEVSK,Unknown
IZHEVSKIY INSTRUMENTALNIY ZAVOD,Russia,IZHEVSK,Unknown
SAINT PETERSBURG STATE UNIVERSITY - SPSU,Russia,SAINT PETERSBURG,Unknown
O. YU. SCHMIDT INSTITUTE OF EARTH PHYSICS - RUSSIAN ACADEMY OF SCIENCES,Russia,TROITSK,Unknown
INSTITUTE FOR HIGH TEMPERATURES - RUSSIAN ACADEMY OF SCIENCES,Russia,MOSCOW,Unknown
THE INSTITUTE FOR GEOTHERMAL RESEARCH OF THE DAGHESTAN SCIENTIFIC CENTRE OF RUSSIAN ACADEMY OF SCIENCES,Russia,MAKHACHKALA,Unknown
"JOINT STOCK COMPANY ""INTERGEOTHERM""",Russia,MOSCOW,Unknown
PUSHCHINO RADIO ASTRONOMY OBSERVATORY OF THE P.N. LEBEDEV PHYSICAL INSTITUTE OF THE RUSSIAN ACADEMY OF SCIENCES,Russia,PUSHCHINO,Unknown
"INSTITUTE OF CHEMISTRY, KOMI SCIENCES CENTRE, URAL BRANCH OF THE RUSSIAN ACADEMY OF SCIENCES",Russia,SYKTYVKAR,Unknown
A.V.TOPCHIEV INSTITUTE OF PETROCHEMICAL SYNTHESIS,Russia,MOSCOW,Unknown
INSTITUTE OF OPERATING SYSTEMS,Russia,,Unknown
VOEIKOV MAIN GEOPHYSICAL OBSERVATORY RESEARCH CENTER FOR ATMOSPHERIC REMOTE SENSING,Russia,LENINGRADSKAYA AREA,Unknown
SAINT PETERSBURG STATE UNIVERSITY,Russia,SAINT PETERSBURG,Unknown
CENTR ANALITICHESKICH ISLEDOVANII I RAZRABOTOK,Russia,KAZAN,Unknown
"GOSUDARSTVENNOE UCHREZHDENIE ULYANOVSKOGO GOSUDARSTVENNOGO UNIVERSITETA NAUCHNO-ISSLEDOVATELSKII CENTR ""REGION""",Russia,ULYANOVSK,Unknown
INTECH CLOSED JOINT STOCK COMPANY,Russia,ST.PETERSBURG,IND
INSTITUTE OF MATHEMATICAL PROBLEMS OF BIOLOGY OF THE RAS,Russia,PUSHINO,Unknown
"INSTITUTE FOR HIGH ENERGY PHYSICS, STATE RESEARCH CENTER OF RF",Russia,PROTVINO,Unknown
PETERSBURG NUCLEAR PHYSICS INSTITUTE,Russia,GATCHINA,Unknown
SCIENTIFIC INSTITUTE OF THEORETICAL AND EXPERIMENTAL PHYSICS - RF STATE RESEARCH CENTER,Russia,MOSCOW,Unknown
SKOBELTSYN INSTITUTE OF NUCLEAR PHYSICS,Russia,MOSCOW,Unknown
KELDYSH INSTITUTE OF APPLIED MATHEMATICS OF THE RAS,Russia,MOSCOW,Unknown
"""KURCHATOV INSTITUTE"" RUSSIAN RESEARCH CENTRE",Russia,MOSCOW,Unknown
MOSCOW STATE UNIVERSITY OF RAILWAY ENGINEERING,Russia,MOSCOW,Unknown
INANOVO STATE POWER UNIVERSITY,Russia,IVANOVO,Unknown
IMPULSE TECHNOLOGIES,Russia,MOSCOW,Unknown
"BELOZERSKY INSTITUTE OF PHYSICO-CHEMICAL BIOLOGY, LOMONOSOV MOSCOW STATE UNIVERSITY",Russia,MOSCOW,Unknown
MOSCOW SCHOOL OF SOCIAL AND ECONOMICS SCIENCES,Russia,MOSCOW,Unknown
"APPLIED TECHNOLOGIES COMPAGNY, LDT",Russia,MOSCOW,Unknown
SHEMYAKIN-OVCHINNIKOV INSTITUTE OF BIOORGANIC CHEMISTRY OF THE RUSSIAN ACADEMY OF SCIENCE,Russia,MOSCOW V-437,Unknown
RUSSIAN ASSOCIATION FOR ENGINEERING EDUCATION,Russia,MOSCOW,Unknown
"MOSCOW STATE UNIVERSITY, A.N. BELOZERSKY INSTITUTE OF PHYSICO-CHEMICAL BIOLOGY.",Russia,MOSCOW,Unknown
MAYAKOVSKY CENTRAL MUNICIPAL PUBLIC LIBRARY,Russia,ST. PETERSBURG,Unknown
P.P. SHIRSHOV INSTITUTE OF OCEANOLOGY OF THE RUSSIAN ACADEMY OF SCIENCES,Russia,MOSCOW,Unknown
GROMOV FLIGHT RESEARCH INSTITUTE,Russia,MOSCOW,Unknown
FUND INSTITUTE FOR URBAN ECONOMICS,Russia,MOSCOU,Unknown
FEDERAL STATE UNITARY ENTREPRISE CENTRAL AEROHYDRODYNAMIC INSTITUTE,Russia,ZHUKOVSKY - MOSCOW REGION,Unknown
INSTITUTE OF SPECTROSCOPY OF RUSSIAN ACADEMY OF SCIENCE,Russia,"Troisk, Moscow region",Unknown
RUSSIAN ASSOCIATION FOR ENGINEERING EDUCATION,Russia,Moscow,Other
IOFFE PHYSICO-TECHNICAL INSTITUTE,Russia,SINT PETERSBURG,Unknown
"CENTRE OF SCIENCE RESEARCH AND STATISTICS, MINISTRY OF EDUCATION AND SCIENCE OF THE RUSSIAN FEDERATION AND RUSSIAN ACADEMY OF SCIENCE",Russia,MOSCOW,Unknown
SAINT-PETERSBURG STATE UNIVERSITY / INTERDISCIPLINARY CENTER FOR ADVANCED PROFESSIONAL EDUCATION,Russia,SINT-PETERSBURG,Unknown
STATE UNIVERSITY - HIGHER SCHOOL OF ECONOMICS / INSTITUTE FOR STATISTICAL STUDIES AND ECONOMICS OF KNOWLEDGE,Russia,MOSCOW,Unknown
CENTRE FOR SCIENCE AND EDUCATION PROGRAMMES,Russia,MOSCOW,Unknown
INDEPENDENT INVESTIGATION AND CONSULTING CENTER,Russia,SAINT-PETERSBURG,Unknown
A.F.IOFFE PHYSICAL-TECHNICAL INSTITUTE OF RAS,Russia,ST. PETERSBURG,Unknown
METEOROLOGICAL SYNTHESIZING CENTRE - EAST OF EMEP,Russia,MOSCOW,Unknown
MURMANSK MARINE BIOLOGICAL INSTITUTE,Russia,MURMANSK,Unknown
INSTITUTE OF ECONOMICS AND INDUSTRIAL ENGINEERING SIBERIAN BRANCH OF RUSSIAN ACADEMY OF SCIENCES,Russia,NOVOSIBIRSK,Unknown
ENERGY RESEARCH INSTITUTE OF THE RUSSIAN ACADEMY OF SCIENCES,Russia,MOSCOW,Unknown
INDEPENDENT NON-PROFIT ORGANISATION -CENTRE FOR ENERGY POLICY-,Russia,MOSCOW,Unknown
