name,country,city,businessType
VOYEKOV MAIN GEOPHYSICAL OBSERVATORY,Russia,ST. PETERSBURG,Unknown
STATE SCIENTIFIC AND RESEARCH INSTITUTE OF MOTOR TRANSPORT (NIIAT),Russia,MOSCOW,Unknown
"FEDERAL STATE UNITARY ""STATE SCIENTIFIC CENTRE OF THE RUSSIAN FEDERATION - RESEARCH INSTITUTE OF ATOMIC REACTORS""",Russia,ULYANOVSK REGION,Unknown
Institute for Systems Biology SPb Company Limited,Russia,saint-Petersburg,Private for-profit entities (excluding Higher or Secondary Education Establishments)
Saint-Petersburg State Forest Academy,Russia,Saint Petersburg,Higher or Secondary Education Establishments
E.T. GAIDAR INSTITUTE FOR THE ECONOMIC POLICY FOUNDATION,Russia,MOSCVA,Higher or Secondary Education Establishments
JOINT STOCK COMPANY UNITED AIRCRAFT CORPORATION,Russia,MOSKVA,Private for-profit entities (excluding Higher or Secondary Education Establishments)
"""FEDERAL STATE UNITARY ENTERPRISE """"INSTITUTE OF AIRCRAFT EQUIPMENT""""""",Russia,ZHUKOVSKY,Private for-profit entities (excluding Higher or Secondary Education Establishments)
JSC CONCERN AVIONICA,Russia,Moscow,Private for-profit entities (excluding Higher or Secondary Education Establishments)
Far Eastern Branch of Russian Academy of Sciences,Russia,Vladivostok,Research Organisations
URAL BRANCH OF THE RUSSIAN ACADEMY OF SCIENCES,Russia,EKATERINBURG,Research Organisations
RUSSIAN FOUNDATION FOR HUMANITIES,Russia,Moscow,Public bodies (excluding Research Organisations and Secondary or Higher Education Establishments)
Ministry of Education and Science of the Russian Federation,Russia,Moscow,Public bodies (excluding Research Organisations and Secondary or Higher Education Establishments)
"NATIONAL ASSOCIATION OF RESEARCH AND EDUCATIONAL E-INFRASTRUCTURES ""E-ARENA"" AUTONOMOUS NON-COMMERCIAL ORGANIZATION",Russia,MOSKVA,Other
SHEMYAKIN AND OVCHINNIKOV INSTITUTE OF BIOORGANIC CHEMISTRY - RUSSIAN ACADEMY OF SCIENCE,Russia,MOSCOW,Higher or Secondary Education Establishments
FEDERAL STATE ORGANISATION ALL-RUSSIAN PLANT QUARANTINE CENTRE,Russia,BYKOVO,Research Organisations
A-TRANS LLC,Russia,MOSKVA,Private for-profit entities (excluding Higher or Secondary Education Establishments)
Moscow State University of Railway Engineering,Russia,Moscow,Higher or Secondary Education Establishments
Petersburg State Transport University,Russia,Saint Petersburg,Higher or Secondary Education Establishments
GEOPHYSICAL CENTER OF THE RUSSIAN ACADEMY OF SCIENCES,Russia,MOSCOW,Private for-profit entities (excluding Higher or Secondary Education Establishments)
Institute of Astronomy of the Russian Academy of Sciences,Russia,Moscow,Research Organisations
V.E. ZUEV INSTITUTE OF ATMOSPHERIC OPTICS OF SIBERIAN BRANCH OF RUSSIAN ACADEMY OF SCIENCES,Russia,TOMSK,Private for-profit entities (excluding Higher or Secondary Education Establishments)
INSTITUTE OF SPECTROSCOPY OF RUSSIAN ACADEMY OF SCIENCES,Russia,TROITSK,Private for-profit entities (excluding Higher or Secondary Education Establishments)
RUSSIAN FEDERAL NUCLEAR CENTRE - ZABABAKHIN ALL-RUSSIAN RESEARCH INSTITUTE OF TECHNICAL PHYSICS,Russia,Snezhinsk,Private for-profit entities (excluding Higher or Secondary Education Establishments)
MEDICAL RADIOLOGICAL RESEARCH CENTRE - RUSSIAN ACADEMY OF MEDICAL SCIENCES,Russia,OBNINSK,Research Organisations
"BIO/ TECHOLOGIES, INNOVATIONS, RESEARCHES LTD",Russia,MOSCOW,Private for-profit entities (excluding Higher or Secondary Education Establishments)
MOLECULAR TECHNOLOGIES,Russia,MOSCOW,Private for-profit entities (excluding Higher or Secondary Education Establishments)
BELOZERSKY INSTITUTE OF PHYSICOCHEMICAL BIOLOGY,Russia,MOSCOW,Research Organisations
SOFTWARE SYSTEMS-PREDICTING BIOLOGY OOO,Russia,Novosibirsk,Private for-profit entities (excluding Higher or Secondary Education Establishments)
"The Establishment of the Russian Academy of Sciences Institute of Cytology and Genetics, Siberian Branch of the Russian Academy of Sciences",Russia,Novosibirsk,Research Organisations
RUSSIAN NEWS & INFORMATION AGENCY RIA NOVOSTI,Russia,MOSCOW,Private for-profit entities (excluding Higher or Secondary Education Establishments)
INSTITUTE FOR INFORMATION TRANSMISSION PROBLEMS RUSSIAN ACADEMY OF SCIENCES IITP,Russia,MOSKVA,Research Organisations
INSTITUTION OF THE RUSSIAN ACADEMYOF SCIENCES THE SPECIAL ASTROPHYSICAL OBSERVATORY OF RAS,Russia,NIZHNIY ARKHYZ ZELENCHUKSKAYA,Unknown
KUTATELADZE INSTITUTE OF THERMOPHYSICS - SIBERIAN BRANCH OF THE RUSSIAN ACADEMY OF SCIENCES - IT SB RAS,Russia,NOVOSIBIRSK,Higher or Secondary Education Establishments
STATE EDUCATIONAL INSTITUTION OF THE HIGHER PROFESSIONAL EDUCATION MOSCOW STATE UNIVERSITY OF FOOD PRODUCTIONS,Russia,MOSKVA,Higher or Secondary Education Establishments
NII MEDICINSKOY GENETIKI TOMSKOGO NAUCHNOGO CENTRA SIBIRSKOGO OTDELENIYA ROSSIYSKOY AKADEMII MEDICINSKIH NAUK,Russia,TOMSK,Research Organisations
NPO SATURN OAO,Russia,RYBINSK YAROSLAV REGION,Private for-profit entities (excluding Higher or Secondary Education Establishments)
M V LOMONOSOV MOSCOW STATE UNIVERSITY,Russia,MOSCOW,Higher or Secondary Education Establishments
SANKT-PETERSBURG RESEARCH INSTITUTE OF FORESTRY,Russia,ARKHANGELSK,Research Organisations
Saint Petersburg State Medical Academy named after I.I. Mechnikov,Russia,Saint Petersburg,Higher or Secondary Education Establishments
FGU FAR EAST FORESTRY RESEARCH INSTITUTE,Russia,KHABAROVSK,Research Organisations
"Ministry of Health and Social Development, Karelian Republic of the Russian Federation",Russia,Petrozavodsk,Public bodies (excluding Research Organisations and Secondary or Higher Education Establishments)
Petrozavodsk State University,Russia,PETROZAVODSK,Higher or Secondary Education Establishments
A.N. BAKH INSTITUTE OF BIOCHEMISTRY OF THE RUSSIAN ACADEMY OF SCIENCES,Russia,MOSCOW,Research Organisations
INSTITUTE OF BIOLOGY OF KOMI SCIENTIFIC CENTRE OF THE URAL BRANCH OF THE RUSSAIN ACADEMY OF SCIENCES,Russia,SYKTYVKAR,Research Organisations
Lumex-marketing LLC,Russia,ST PETERSBURG,Private for-profit entities (excluding Higher or Secondary Education Establishments)
Autonomous non-commercial organisation EcoPolicy Research and Consulting,Russia,Moscow,Research Organisations
University Medicine OOO,Russia,Moscow,Private for-profit entities (excluding Higher or Secondary Education Establishments)
"INSTITUTE OF BIOCHEMISTRY AND GENETICS, UFA SCIENTIFIC CENTRE OF RAS",Russia,UFA,Research Organisations
Vavilov Institute of General Genetics - Russian Academy of Sciences,Russia,Moscow,Research Organisations
NATIONAL RESEARCH CENTER OF MENTAL HEALTH - RUSSIAN ACADEMY OF MEDICAL SCIENCES,Russia,MOSCOW,Research Organisations
ENGELHARDT INSTITUTE OF MOLECULAR BIOLOGY OF RUSSIAN ACADEMY,Russia,MOSCOW,Research Organisations
FEDERAL STATE EDUCATIONAL BUDGET INSTITUTION OF HIGHER VOCATIONAL TRAINING MOSCOW STATE UNIVERSITY OF GEODESY AND CARTOGRAPHY,Russia,MOSKVA,Higher or Secondary Education Establishments
SAINT PETERSBURG STATE UNIVERSITY OF AEROSPACE INSTRUMENTATION*SUAI,Russia,ST PETERSBURG,Higher or Secondary Education Establishments
N.N. Petrov Institute of Oncology,Russia,St.-Petersburg,Public bodies (excluding Research Organisations and Secondary or Higher Education Establishments)
FINANSOVIY UNIVERSITET PRI PRAVITELSTVE ROSSIYSKOY FEDERACII,Russia,MOSKVA,Higher or Secondary Education Establishments
"""St. Petersburg State Healthcare Institution """"Centre for Prevention and Control of AIDS and Infectious Diseases""""""",Russia,St. Petersburg,Public bodies (excluding Research Organisations and Secondary or Higher Education Establishments)
KABARDINO-BALKARIAN STATE UNIVERSITY NAMED AFTER KH M BERBEKOV,Russia,NALCHIK,Higher or Secondary Education Establishments
NON-COMMERCIAL FOUNDATION OF ECONOMIC DEVELOPMENT AND SOCIAL STABILITY CO-OPERATION_ ECONOMIC AND FINANCIAL RESEARCH AND DEVELOPMENT CENTER,Russia,Moscow,Research Organisations
FEDERAL STATE UNITARY ENTERPRISE SOUTHERN URALS BIOPHYSICS INSTITUTE OF FEDERAL MEDICOBIOLOGICAL AGENCY,Russia,OZYORSK,Research Organisations
INSTITUTE OF BIOLOGY OF KARELIAN RESARCH CENTRE RUSSIAN ACADEMY OF SCIENCES,Russia,PETROZAVODSK REPUBLIC OF KARELIA,Research Organisations
STATE SCIENTIFIC AND RESEARCH INSTITUTION INSTITUTE OF MINERALOGY OF THE URAL BRANCH OF THE RUSSIAN ACADEMY OF SCIENCES,Russia,MIASS CHELYABINSK,Research Organisations
FEDERAL STATE INSTITUTION OF SCIENCE URALS RESEARCH CENTER FOR RADIATION MEDICINE FEDERAL MEDICAL-BIOLOGICAL AGENCY,Russia,CHELYABINSK,Research Organisations
NEW TECHNOLOGIES AND SERVICES LLC,Russia,SAINT PETERSBURG,Private for-profit entities (excluding Higher or Secondary Education Establishments)
SEC SMART SOLUTIONS,Russia,SAMARA,Private for-profit entities (excluding Higher or Secondary Education Establishments)
OAO NAUCHNO-TECHNICHESKIY CENTR ELECTROENERGETIKA,Russia,MOSCOW,Private for-profit entities (excluding Higher or Secondary Education Establishments)
UBITEL CO LTD,Russia,SINT PETERBURG,Private for-profit entities (excluding Higher or Secondary Education Establishments)
INSTITUTION OF RUSSIAN ACADEMY OF MEDICAL SCIENCES SCIENTIFIC RESEARCHINSTITUTE OF CARDIOLOGY OF SIBERIAN DEPARTMENT OF RAMS,Russia,Tomsk,Research Organisations
"ALMAZOV FEDERAL HEART, BLOOD AND ENDOCRINOLOGY CENTRE, FEDERATION AGENCY ON HIGH MEDICAL TECHNOLOGIES",Russia,Saint-Petersburg,Research Organisations
RUSSIAN CARDIOLOGY RESEARCH AND PRODUCTION COMPLEX,Russia,Moscow,Public bodies (excluding Research Organisations and Secondary or Higher Education Establishments)
"INSTITUTE OF TERRESTRIAL MAGNETISM, IONOSPHERE AND RADIO WAVE PROPAGATION OF THE RUSSIAN ACADEMY OF SCIENCES",Russia,TROITSK,Research Organisations
THE DESIGN & RESEARCH INSTITUTE OF POWER SYSTEMS AND NETWORKS ENERGOSETPROJECT,Russia,MOSCOW,Private for-profit entities (excluding Higher or Secondary Education Establishments)
System Operator-Central Dispatch Administration of the Unified Energy System,Russia,Moscow,Private for-profit entities (excluding Higher or Secondary Education Establishments)
MELENTIEV ENERGY SYSTEMS INSTITUTE OF SIBERIAN BRANCH OF THE RUSSIAN ACADEMY OF SCIENCES,Russia,IRKUTSK,Research Organisations
INSTITUTE OF POWER SYSTEMS,Russia,MOSCOW,Private for-profit entities (excluding Higher or Secondary Education Establishments)
INSTITUTE OF CONTROL SCIENCES OF THE RUSSIAN ACADEMY OF SCIENCES,Russia,MOSCOW,Research Organisations
HIGH VOLTAGE DIRECT CURRENT POWER TRANSMISSION RESEARCH INSTITUTE,Russia,St. Petersburg,Private for-profit entities (excluding Higher or Secondary Education Establishments)
FEDERAL STATE UNITARY ENTERPRISE ALL-RUSSIAN ELECTROTECHNICAL INSTITUTE NAMED AFTER V.I. LENIN,Russia,MOSCOW,Private for-profit entities (excluding Higher or Secondary Education Establishments)
POWER SYSTEM EMERGENCY CONTROL LABORATORY,Russia,NOVOSIBIRSK,Private for-profit entities (excluding Higher or Secondary Education Establishments)
KONSTRUKTORSKOE BURO KHIMAVTOMATIKI OPEN STOCK COMPANY,Russia,Voronezh,Private for-profit entities (excluding Higher or Secondary Education Establishments)
SCIENTIFIC-PRODUCTION ENTERPRISE LAZMA LTD,Russia,MOSKVA,Private for-profit entities (excluding Higher or Secondary Education Establishments)
P.N. LEBEDEV PHYSICAL INSTITUTE OF THE RUSSIAN ACADEMY OF SCIENCES,Russia,MOSKVA,Research Organisations
INTERNATIONAL EDUCATIONAL AND RESEARCH LASER CENTER OF M V LOMONOSOV MOSCOW STATE UNIVERSITY,Russia,MOSKVA,Higher or Secondary Education Establishments
INSTITUTION OF THE RUSSIAN ACADEMYOF SCIENCES FIBER OPTICS RESEARCH CENTER RAS,Russia,Moscow,Research Organisations
INSTITUTE OF SOLID STATE PHYSICS RUSSIAN ACADEMY OF SCIENCES,Russia,CHERNOGOLOVKA,Higher or Secondary Education Establishments
The Likhachev Plant (AMO ZIL),Russia,Moscow,Private for-profit entities (excluding Higher or Secondary Education Establishments)
"""FEDERAL STATE UNITARY ENTERPRISE """"CENTRAL, ORDER OF THE RED BANNER, SCIENTIFIC RESEARCH AUTOMOBILE AND ENGINE INSTITUTE""",Russia,MOSCOW,Private for-profit entities (excluding Higher or Secondary Education Establishments)
SAINT PETERSBURG SCIENTIFIC RESEARCH CENTRE FOR ECOLOGICAL SAFETY OF RUSSIAN ACADEMY OF SCIENCES,Russia,SAINT PETERSBURG,Research Organisations
A.V. TOPCHIEV INSTITUTE OF PETROCHEMICAL SYNTHESIS - RUSSIAN ACADEMY OF SCIENCES,Russia,MOSKVA,Public bodies (excluding Research Organisations and Secondary or Higher Education Establishments)
RUSSIAN TECHNOLOGY TRANSFER NETWORK,Russia,OBNINSK,Private for-profit entities (excluding Higher or Secondary Education Establishments)
Membrane Technology Innovation Enterprise,Russia,Krasnodar,Private for-profit entities (excluding Higher or Secondary Education Establishments)
Closed Joint Stock Company Scientific and Technical Center,Russia,Vladimir,Private for-profit entities (excluding Higher or Secondary Education Establishments)
Kuban State University,Russia,Krasnodar,Higher or Secondary Education Establishments
REGIONAL INTER-BRANCH CENTRE YUGTECHINFORM,Russia,KRASNODAR,Private for-profit entities (excluding Higher or Secondary Education Establishments)
KURNAKOV INSTITUTE OF GENERAL AND INORGANIC CHEMISTRY OF THE RUSSIAN ACADEMY OF SCIENCES,Russia,MOSCOW,Research Organisations
AUTONOMNAYA NEKOMMERCHESKAYA ORGANIZACIYA CENTR NEZAVISIMIIH SOCIOLOGICHESKIH ISSLEDOVANII,Russia,ST PETERSBURG,Research Organisations
SMW ENGINEERING LTD OOO,Russia,ST PETERSBURG,Private for-profit entities (excluding Higher or Secondary Education Establishments)
FEDERAL STATE BUDGETARY INSTITUTION OF SCIENCE THE INSTITUTE FOR THE STUDY OF SCIENCE OF RUSSIAN ACADEMYOF SCIENCES,Russia,Moscow,Research Organisations
MOSCOW INSTITUTE OF ELECTRONIC TECHNOLOGY (TECHNICAL UNIVERSITY),Russia,Moscow,Higher or Secondary Education Establishments
INSTITUTE OF BIOMEDICAL CHEMISTRY - RUSSIAN ACADEMY OF SCIENCES,Russia,MOSKVA,Higher or Secondary Education Establishments
SA KHRISTIANOVICH INSTITUTE OF THEORETICAL AND APPLIED MECHANICS OF SIBERIAN BRANCH OF RUSSIAN ACADEMY OFSCIENCE*ITAM OF SB RAS,Russia,NOVOSIBIRSK,Research Organisations
JOINT STOCK COMPANY MILITARY INDUSTRIAL CORPORATION NPO MASHINOSTROYENIA,Russia,MOSKVA,Private for-profit entities (excluding Higher or Secondary Education Establishments)
Foundation of the Russian Academy of Sciences Schmidt Institute of Physics of the Earth RAS,Russia,MOSKVA,Research Organisations
Institute of Marine Geology and Geophysics far Eastern Branch of the Russian Academy of Sciences,Russia,YUZHNO-SAKHALINSK,Research Organisations
SPACE RESEARCH INSTITUTE OF RUSSIAN ACADEMY OF SCIENCES,Russia,MOSKVA,Research Organisations
FEDERAL STATE BUDGET FINANCED INSTITUTION OF SCIENCES ST. PETERSBURG INSTITUTE FOR INFORMATICS AND AUTOMATION OF THE RUSSIAN ACADEMY OF SCIENCES,Russia,ST PETERSBURG,Higher or Secondary Education Establishments
Institution of Russian Academy of Sciences Institute for Systems Analysis RAS,Russia,Moscow,Research Organisations
METEOROLOGICAL SYNTHESIZING CENTREEAST*MSC-EAST MSC-E,Russia,MOSKVA,Research Organisations
RUSSIAN FEDERAL RESEARCH INSTITUTE OF FISHERIES AND OCEANOGRAPHY,Russia,MOSCOW,Research Organisations
TVER TECHNICAL UNIVERSITY,Russia,TVER,Higher or Secondary Education Establishments
RUSSIAN FEDERATION STATE SCIENTIFIC CENTER - INSTITUTE OF BIOMEDICAL PROBLEMS OF THE RUSSIAN ACADEMY OF SCIENCES - SSC RF IBMP RAS,Russia,MOSCOW,Research Organisations
Institute of Biophysics of Siberian Branch of Russian Academy of Sciences,Russia,Krasnoyarsk,Research Organisations
"""Joint Stock Company """"Russian Space Systems""""""",Russia,MOSCOW,Private for-profit entities (excluding Higher or Secondary Education Establishments)
V.N.SUKACHEV INSTITUTE OF FOREST SIBERIAN BRANCH OF THE RUSSIAN ACADEMY OF SCIENCES,Russia,KRASNOYARSK,Research Organisations
RUSSIAN ACADEMY OF SCIENCES INSTITUTE OF GEOGRAPHY OF RUSSIAN ACADEMYOF SCIENCES,Russia,MOSKVA,Higher or Secondary Education Establishments
FEDERAL STATE UNITARY ENTERPRISE STATE SCIENTIFIC-RESEARCH INSTITUTE OF GENETICS AND BREEDING OF INDUSTRIAL MICROORGANISMS,Russia,MOSKVA,Private for-profit entities (excluding Higher or Secondary Education Establishments)
INSTITUTE OF ECOLOGY AND GENETICS OF MICROORGANISMS THE URAL BRANCH OFTHE RUSSIAN ACADEMY OF SCIENCES,Russia,PERM,Research Organisations
RUSSIAN ACADEMY OF SCIENCES INSTITUTION INSTITUTE OF BIOCHEMISTRY ANDPHYSIOLOGY OF PLANTS AND MICROORGANISMS,Russia,Saratov,Higher or Secondary Education Establishments
FEDERAL STATE EDUCATIONAL ESTABLISHMENT OF HIGHER PROFESSIONAL EDUCATION RUSSIAN STATE AGRARIAN UNIVERSITY-MOSCOW TIMIRYAZEV AGRICULTURAL ACADEMY,Russia,MOSKVA,Higher or Secondary Education Establishments
THE STATE ENTERPRISE NATIONAL SCIENTIFIC & RESEARCH INSTITUTE ON AGRICULTURAL METEOROLOGY*SE NSRIAM GU VNIISHM NIAM,Russia,OBNINSK,Research Organisations
"""STATE INSTITUTION OF ULYANOVSK STATE UNIVERSITY RESEARCH AND DEVELOPMENT CENTRE """"REGION""""""",Russia,Ulyanovsk,Higher or Secondary Education Establishments
LIMITED LIABILITY COMPANY SCIENTIFIC RESERCH CENTER REGION,Russia,Ulyanovsk,Private for-profit entities (excluding Higher or Secondary Education Establishments)
INSTITUTE FOR AGRICULTURAL MARKET STUDIES OOO,Russia,MOSKVA,Private for-profit entities (excluding Higher or Secondary Education Establishments)
PROTIVORAKOVOE OBSHESTVO ROSSII,Russia,MOSKVA,Research Organisations
Centre Bioengineering of the Russian academy of sciences,Russia,Moscow,Research Organisations
SPECIAL RESEARCH BUREAU FOR AUTOMATION OF MARINE RESEARCHES FAR EAST BRANCH RUSSIAN ACADEMY OF SCIENCES,Russia,YUZHNO SAKHALINSK,Research Organisations
CKTI - VIBROSEISM LTD,Russia,SAINT PETERSBURG,Private for-profit entities (excluding Higher or Secondary Education Establishments)
SAINT PETERSBURG ELECTROTECHNICAL UNIVERSITY LETI,Russia,SAINT PETERSBURG,Higher or Secondary Education Establishments
THE D.I. IVANOVSKY INSTITUTE OF VIROLOGY OF THE MINISTRY OF THE HEALTHOF THE RUSSIAN FEDERATION,Russia,MOSKVA,Research Organisations
KUZNETSOV OAO,Russia,SAMARA,Private for-profit entities (excluding Higher or Secondary Education Establishments)
SCIENTIFIC PRODUCTION ENTREPRISE AEROSILA OAO,Russia,Stupino,Private for-profit entities (excluding Higher or Secondary Education Establishments)
FEDERAL STATE UNITARY ENTERPRISE STATE RESEARCH AND DEVELOPMENT INSTITUTE OF AERONAVIGATION,Russia,MOSKVA,Research Organisations
Central Research Institute for Special Machine Building,Russia,"Khotkovo, Moscow Region",Private for-profit entities (excluding Higher or Secondary Education Establishments)
NON-STATE EDUCATIONAL INSTITUTION EDUCATIONAL SCIENTIFIC AND EXPERIMENTAL CENTER OF MOSCOW INSTITUTE OF PHYSICS AND TECHNOLOGY,Russia,"DOLGOPRUDNY, MOSCOW",Other
NIK-SAMARA OOO,Russia,Samara,Private for-profit entities (excluding Higher or Secondary Education Establishments)
SCIENTIFIC AND PRODUCTION ENTERPRISE RADAR-MMS OAO,Russia,St. Petersburg,Private for-profit entities (excluding Higher or Secondary Education Establishments)
INSTITUTE FOR MATHEMATICAL MODELLING OF RUSSIAN ACADEMY OF SCIENCES,Russia,MOSCOW,Research Organisations
NATIONAL RESEARCH UNIVERSITY MOSCOWPOWER ENGINEERING INSTITUTE-MPEI,Russia,MOSKVA,Higher or Secondary Education Establishments
FEDERALNOE GOSUDARSTVENNOE UNITARNOPREDPRIYATIE TSENTRALNY NAUCHNO- ISSLEDOVATELSKY INSTITUT MACHINOSTROENIYA,Russia,KOROLEV,Research Organisations
Institution of the Russian Academy of Sciences Joint Institute for High Temperatures RAS,Russia,Moscow,Research Organisations
SUKHOI CIVIL AIRCRAFT ZAO,Russia,MOSCOW,Private for-profit entities (excluding Higher or Secondary Education Establishments)
VOLOGODSKIY SCIENTIFIC CENTER OF THE RUSSIAN ACADEMY OF SCIENCES,Russia,VOLOGDA,Research Organisations
BALAKOVO CARBON PRODUCTION LLC,Russia,BALAKOVO,Private for-profit entities (excluding Higher or Secondary Education Establishments)
FEDERAL ENTERPRISE LAVOCHKIN ASSOCIATION,Russia,KHIMKI,Private for-profit entities (excluding Higher or Secondary Education Establishments)
BAUMAN MOSCOW STATE TECHNICAL UNIVERSITY,Russia,MOSCOW,Higher or Secondary Education Establishments
SIEMENS OOO,Russia,MOSKVA,Private for-profit entities (excluding Higher or Secondary Education Establishments)
"""Joint stock company Centre of Scientific and Technical Service """"Dinamika""""""",Russia,Zhukovsky,Private for-profit entities (excluding Higher or Secondary Education Establishments)
"Scientific & Production Company ""Delphin-Informatika""",Russia,Moscow,Private for-profit entities (excluding Higher or Secondary Education Establishments)
INSTITUTE OF PHYSICOCHEMICAL AND BIOLOGICAL PROBLEMS IN SOIL SCIENCE OF RUSSIAN ACADEMY OF SCIENCES,Russia,PUSHCHINO,Research Organisations
SIBTERMOKHIM OOO,Russia,TOMSK,Private for-profit entities (excluding Higher or Secondary Education Establishments)
JOINT STOCK COMPANY RESEARCH AND DESIGN INSTITUTE FOR INFORMATION TECHNOLOGY SIGNALLING AND TELECOMMUNICATIONS ON RAILWAY TRANSPORT,Russia,MOSKVA,Private for-profit entities (excluding Higher or Secondary Education Establishments)
Siberian State University of Telecommunications and Informatics,Russia,Novosibirsk,Higher or Secondary Education Establishments
FEDERAL STATE BUDGETARY INSTITUTION OF SCIENCE POLAR GEOPHYSICAL INSTITUTE OF THE KOLA SCIENCE CENTER OF THE RUSSIAN ACADEMY OF SCIENCE,Russia,MURMANSK,Research Organisations
THE FEDERAL STATE SCIENTIFIC INSTITUTION SAINT-PETERSBURG SCIENTIFIC RESEARCH PASTEUR INSTITUTE OF EPIDEMIOLOGY AND MICROBIOLOGY,Russia,Saint Petersburg,Research Organisations
Viatech,Russia,Moscow,Private for-profit entities (excluding Higher or Secondary Education Establishments)
STATE RESEARCH CENTRE OF RUSSIAN FEDERATION TROITSK INSTITUTE FOR INNOVATION AND FUSION RESEARCH,Russia,"Troitsk, Moscow region",Research Organisations
AVIADVIGATEL OAO,Russia,Perm,Private for-profit entities (excluding Higher or Secondary Education Establishments)
ABBYY PRODUCTION LLC,Russia,MOSCOW,Private for-profit entities (excluding Higher or Secondary Education Establishments)
ENERGY RESEARCH INSTITUTE OF THE RUSSIAN ACADEMY OF SCIENCES,Russia,MOSCOW,Research Organisations
SOFT-IMPACT OOO,Russia,ST PETERSBURG,Private for-profit entities (excluding Higher or Secondary Education Establishments)
CENTER FOR SOCIOLOGICAL STUDIES MGU,Russia,Moscow,Research Organisations
OPEN HEALTH INSTITUTE FOUNDATION,Russia,Moscow,Research Organisations
STATE RESEARCH AND PRODUCTION SPACE ROCKET CENTER TSSKB PROGRESS,Russia,samara,Research Organisations
RYAZAN STATE RADIO ENGINEERING UNIVERSITY,Russia,RYAZAN,Higher or Secondary Education Establishments
ARCTIC AND ANTARCTIC RESEARCH INSTITUTE,Russia,SAINT PETERSBURG,Research Organisations
InMatrixs,Russia,Moscow,Private for-profit entities (excluding Higher or Secondary Education Establishments)
"RESEARCH INSTITUTE ""SITRONICS LABS""",Russia,Moscow,Research Organisations
Monitor Soft,Russia,Moscow,Private for-profit entities (excluding Higher or Secondary Education Establishments)
A. ISHLINSKY INSTITUTE FOR PROBLEMS IN MECHANICS RUSSIAN ACADEMY OF SCIENCE*IPMECH RAS,Russia,MOSCOW,Higher or Secondary Education Establishments
FEDERAL STATE UNITARY ENTERPRISE ALL-RUSSIAN SCIENTIFIC-RESEARCH INSTITUTE OF AVIATION MATERIALS,Russia,MOSCOW,Private for-profit entities (excluding Higher or Secondary Education Establishments)
FEDERAL STATE BUDGETARY EDUCATIONAL INSTITUTION OF HIGHER PROFESSIONAL EDUCTAION STATE UNIVERSITY OF MANAGEMENT,Russia,MOSKVA,Higher or Secondary Education Establishments
NEKOMMERCHESKOE PARTNERSTVO BIZNES PARK UNIKUM - UCHEBNO NAUCHNYJ INNOVACIONNYJ KOMPLEKS USPESHNOGO MENEDZHMENTA,Russia,MOSCOW,Other
VORONEZH STATE UNIVERSITY,Russia,VORONEZH,Higher or Secondary Education Establishments
Far Eastern Center for Economic Development,Russia,VLADIVOSTOK,Research Organisations
APATIT OAO,Russia,KIROVSK,Private for-profit entities (excluding Higher or Secondary Education Establishments)
INSTITUT GEOEKOLOGII ROSSIYSKOY AKADEMII NAUK,Russia,MOSKVA,Higher or Secondary Education Establishments
RESEARCH CENTRE DYNAMICS OF THE NEARSHORE ZONE,Russia,GELENDZHIK,Research Organisations
INSTITUTE OF LIMNOLOGY - RUSSIAN ACADEMY OF SCIENCES,Russia,SAINT PETERSBURG,Research Organisations
GOSUDARSTVENNOE UCHREZHDENIE GOSUDARSTVENNIY OKEANOGRAFICHESKIY INSTITUT-STATE OCEANOGRAPHIC INSTITUTE SO,Russia,MOSKVA,Higher or Secondary Education Establishments
STATE RESEARCH CENTER - BURNASYAN FEDERAL MEDICAL BIOPHYSICAL CENTER OF FEDERAL MEDICAL BIOLOGICAL AGENCY,Russia,Moscow,Research Organisations
Siberian Transport University of Railway Engineering,Russia,Novosibirsk,Higher or Secondary Education Establishments
Omsk State Transport University,Russia,Omsk,Higher or Secondary Education Establishments
Irkutsk State University of Railway Engineering,Russia,Irkutsk,Higher or Secondary Education Establishments
STATE UNITARY ENTERPRISE RUSSIAN RESEARCH AND DESIGN INSTITUTE FOR RAILWAY INFORMATION AUTOMATION AND COMMUNICATION MINISTRY OF RAILWAYS RUS,Russia,MOSKVA,Private for-profit entities (excluding Higher or Secondary Education Establishments)
Urals State University of Railway Transport,Russia,Yekaterinburg,Higher or Secondary Education Establishments
INSTITUTE FOR SYSTEM PROGRAMMING OF THE RUSSIAN ACADEMY OF SCIENCES,Russia,MOSCOW,Research Organisations
SCIENTIFIC AGENCY MARINE ARCTIC EXPLORATION SA MAE,Russia,MOSCOW,Private for-profit entities (excluding Higher or Secondary Education Establishments)
"Institute of Internal Medicine, Siberian Branch of the Russian Academy of Medical Sciences",Russia,Novosibirsk,Higher or Secondary Education Establishments
THE INSTITUTE OF THERMAL PHYSICS OF THE URAL BRANCH OF THE RUSSIAN ACADEMY OF SCIENCE,Russia,EKATERINBURG,Research Organisations
Andreyev Acoustics Institute,Russia,Moscow,Private for-profit entities (excluding Higher or Secondary Education Establishments)
NATIONAL INSTITUTE OF AVIATION TECNOLOGY,Russia,MOSKVA,Private for-profit entities (excluding Higher or Secondary Education Establishments)
International Research Institute for Advanced Systems,Russia,Moscow,Research Organisations
